id,title,decision,category,notes
30314990,Conceptual review of measuring functional impairment: findings from the Weiss Functional Impairment Rating Scale.,OUT_OF_SCOPE,not_pharmacotherapy,No pharma intervention
27032628,Effects of citalopram on neuropsychiatric symptoms in Alzheimer's dementia: Evidence from the CitAD study,OUT_OF_SCOPE,non_interventional,Study type: secondary analysis
28185791,Evolution of Symptom Burden of Advanced Lung Cancer Over a Decade,OUT_OF_SCOPE,not_pharmacotherapy,No pharma intervention
29265831,Prevention of relapse/recurrence in major depressive disorder with either mindfulness-based cognitive therapy or cognitive therapy.,OUT_OF_SCOPE,not_pharmacotherapy,No pharma intervention
29781145,Core outcome set for gene therapy in haemophilia: Results of the coreHEM multistakeholder project,OUT_OF_SCOPE,not_pharmacotherapy,No pharma intervention
30946049,HDL from an Alzheimer's disease perspective,OUT_OF_SCOPE,not_mental_health,No MH condition identified
31691827,Long-term study of the safety and maintenance of efficacy of solriamfetol (JZP-110) in the treatment of excessive sleepiness in participants with narcolepsy or obstructive sleep apnea.,OUT_OF_SCOPE,not_canadian,No Canadian site/PI indicators
28167747,Integrated collaborative care teams to enhance service delivery to youth with mental health and substance use challenges: protocol for a pragmatic randomised controlled trial.,OUT_OF_SCOPE,not_pharmacotherapy,No pharma intervention
33559354,Preclinical and clinical biomarker studies of CT1812: A novel approach to Alzheimer's disease modification.,OUT_OF_SCOPE,not_canadian,No Canadian site/PI indicators
28473524,A realist evaluation of patients' decisions to deprescribe in the EMPOWER trial.,OUT_OF_SCOPE,not_mental_health,No MH condition identified
31958417,"Addition of anti-thymocyte globulin to standard graft-versus-host disease prophylaxis versus standard treatment alone in patients with haematological malignancies undergoing transplantation from unrelated donors: final analysis of a randomised, open-label, multicentre, phase 3 trial.",OUT_OF_SCOPE,pharma_not_targeting_mh,"Pharma targets GVHD prophylaxis, not mental health; depression is incidental outcome"
29391286,Health-Related Quality of Life with Subcutaneous C1-Inhibitor for Prevention of Attacks of Hereditary Angioedema.,OUT_OF_SCOPE,not_canadian,No Canadian site/PI indicators
29457627,Combination pharmacotherapy for the treatment of fibromyalgia in adults.,OUT_OF_SCOPE,not_mental_health,No MH condition identified
28276086,A randomized-controlled trial to examine the effectiveness of the 'Home-but not Alone' mobile-health application educational programme on parental outcomes.,OUT_OF_SCOPE,not_pharmacotherapy,No pharma intervention
27772641,Intensive Hemodialysis and Health-Related Quality of Life.,OUT_OF_SCOPE,not_pharmacotherapy,No pharma intervention
31848209,Transcranial magnetic stimulation in Alzheimer's disease: Are we ready?,OUT_OF_SCOPE,not_canadian,No Canadian site/PI indicators
35101785,Associations between psoriasis and mental illness: an update for clinicians.,OUT_OF_SCOPE,not_pharmacotherapy,No pharma intervention
