id,title,decision,category,notes
33618769,Gender-related variables for health research,OUT_OF_SCOPE,not_canadian,No Canadian site/PI indicators
31764959,Efficacy and Safety of Lanabecestat for Treatment of Early and Mild Alzheimer Disease: The AMARANTH and DAYBREAK-ALZ Randomized Clinical Trials.,OUT_OF_SCOPE,not_canadian,No Canadian site/PI indicators
27126852,Impact of a Mental Health Curriculum on Knowledge and Stigma Among High School Students: A Randomized Controlled Trial.,OUT_OF_SCOPE,not_pharmacotherapy,No pharma intervention
26620289,A Multiple-City RCT of Housing First With Assertive Community Treatment for Homeless Canadians With Serious Mental Illness.,OUT_OF_SCOPE,not_pharmacotherapy,No pharma intervention
28697562,The Montreal Cognitive Assessment: Normative Data from a Large Swedish Population-Based Cohort.,OUT_OF_SCOPE,not_rct,No RCT indicators found
35229024,Treatment with glucagon-like peptide-1 receptor agonists and incidence of dementia: Data from pooled double-blind randomized controlled trials and nationwide disease and prescription registers.,OUT_OF_SCOPE,not_canadian,No Canadian site/PI indicators
28530238,MicroRNAs 146a/b-5 and 425-3p and 24-3p are markers of antidepressant response and regulate MAPK/Wnt-system genes.,OUT_OF_SCOPE,not_canadian,No Canadian site/PI indicators
29920656,Antipsychotics for treatment of delirium in hospitalised non-ICU patients.,OUT_OF_SCOPE,not_canadian,No Canadian site/PI indicators
29322164,Efficacy of Transdermal Estradiol and Micronized Progesterone in the Prevention of Depressive Symptoms in the Menopause Transition: A Randomized Clinical Trial.,OUT_OF_SCOPE,not_canadian,No Canadian site/PI indicators
