id,title,final_decision,category,vote_count,conflict_flag,reconciliation_notes
38520501,"Assessing the Effects of Metabolic Disruption, Body Mass Index and Inflammation on Depressive Symptoms in Post-COVID-19 Condition: A Randomized Controlled Trial on Vortioxetine.",MAP,depression,MAP:3,none,unanimous; RCT of vortioxetine (pharmacological) for depressive symptoms; Canadian recruitment (recruited in Canada); post-COVID condition with depressive symptoms
38501087,"Satisfaction, engagement, and outcomes in internet-delivered cognitive behaviour therapy adapted for people of diverse ethnocultural groups: an observational trial with benchmarking.",OUT_OF_SCOPE,non-pharmacological,OUT_OF_SCOPE:3,none,unanimous; non-pharmacological ICBT; observational pilot study
38476394,Virtual reality hypnosis prior to radiofrequency thermocoagulation for patients with chronic pain: an exploratory clinical trial.,OUT_OF_SCOPE,non-mental-health,OUT_OF_SCOPE:3,none,unanimous; chronic pain VR hypnosis; Belgium; not mental health
38459601,"Validation and evaluation of school-based mental health literacy training program ""The Guide Cymru"" in Iranian adolescent students aged 13-15: study protocol.",OUT_OF_SCOPE,protocol_only,OUT_OF_SCOPE:3,none,unanimous; protocol only; non-pharmacological school program; Iran
38459453,"An Integrated Care Pathway for depression in adolescents: protocol for a Type 1 Hybrid Effectiveness-implementation, Non-randomized, Cluster Controlled Trial.",OUT_OF_SCOPE,protocol_only,OUT_OF_SCOPE:3,none,unanimous; protocol only; non-randomized design
38425284,"Adjunctive Brexpiprazole for Patient Life Engagement in Major Depressive Disorder: A Canadian, Phase 4, Open-Label, Interventional Study",UNCERTAIN,depression,"UNCERTAIN:2,MAP:1",minor,Canadian phase 4 open-label study of brexpiprazole for MDD; pharmacological; Canadian sites; open-label without randomization so may not meet RCT criterion
38402133,The Impact of Educational Materials on Parental Anxiety and Productivity: A Clinical Trial in Pediatric Appendicitis.,OUT_OF_SCOPE,non-mental-health,OUT_OF_SCOPE:3,none,unanimous; quasi-experimental study of educational brochure; parental anxiety in surgical context; not mental disorder pharmacotherapy
38384879,Self-managing symptoms of Long COVID: an education and strategies research protocol.,OUT_OF_SCOPE,protocol_only,OUT_OF_SCOPE:3,none,unanimous; protocol only; non-pharmacological education intervention
38377520,Impact of Cytochrome P450 Genetic Variation on Patient-Reported Symptom Improvement and Side Effects Among Children and Adolescents Treated with Fluoxetine.,OUT_OF_SCOPE,observational,OUT_OF_SCOPE:3,none,unanimous; observational pharmacogenomics study; not an RCT
38348362,An integrated precision medicine approach in major depressive disorder: a study protocol to create a new algorithm for the prediction of treatment response.,OUT_OF_SCOPE,protocol_only,OUT_OF_SCOPE:3,none,unanimous; protocol only; European study
38324666,The equivalence of psychodynamic therapy and cognitive behavioral therapy for depressive disorders in adults: A meta-analytic review.,OUT_OF_SCOPE,review/meta-analysis,OUT_OF_SCOPE:3,none,unanimous; meta-analysis
38284409,CYP2D6 Phenotype Influences Pharmacokinetic Parameters of Venlafaxine: Results from a Population Pharmacokinetic Model in Older Adults with Depression.,OUT_OF_SCOPE,secondary_analysis,OUT_OF_SCOPE:3,none,unanimous; pharmacokinetic modeling secondary analysis
38284364,Research encouraging off-label use of quetiapine: A systematic meta-epidemiological analysis.,OUT_OF_SCOPE,review/meta-analysis,OUT_OF_SCOPE:3,none,unanimous; meta-epidemiological analysis
38266665,"Rationale and design of the NODE-303 study: evaluating the safety of symptom-prompted, self-administered etripamil for paroxysmal supraventricular tachycardia episodes in real-world settings.",OUT_OF_SCOPE,non-mental-health,OUT_OF_SCOPE:3,none,unanimous; cardiac arrhythmia drug trial; not mental health
38259980,Topical anesthetics for needle-related pain in adults and children (TOPIC): a mini-review.,OUT_OF_SCOPE,review/meta-analysis,OUT_OF_SCOPE:3,none,unanimous; systematic review; not mental health
38253819,The influence of APOE status on rate of cognitive decline.,OUT_OF_SCOPE,observational,OUT_OF_SCOPE:3,none,unanimous; observational longitudinal study of APOE
38239907,The impact of a telephone hotline on suicide attempts and self-injurious behaviors in patients with borderline personality disorder.,OUT_OF_SCOPE,non-pharmacological,OUT_OF_SCOPE:3,none,unanimous; non-pharmacological telephone hotline; France
38191370,A randomized sham-controlled trial of high-dosage accelerated intermittent theta burst rTMS in major depression: study protocol.,OUT_OF_SCOPE,protocol_only,OUT_OF_SCOPE:3,none,unanimous; protocol only; non-pharmacological neurostimulation
38180531,Cognitive behavioural therapy for social anxiety disorder in people with bipolar disorder: a case series.,OUT_OF_SCOPE,observational,OUT_OF_SCOPE:3,none,unanimous; case series (<10 typically); non-pharmacological CBT
38166894,The acceptability and feasibility of a virtual mantram program for patients with posttraumatic stress disorder and substance use disorders: mixed method results.,OUT_OF_SCOPE,non-pharmacological,OUT_OF_SCOPE:3,none,unanimous; non-pharmacological mantram program; feasibility study without randomization
38107671,"Long-term effects of cognitive training in Parkinson's disease: A randomized, controlled trial.",OUT_OF_SCOPE,non-pharmacological,OUT_OF_SCOPE:3,none,unanimous; non-pharmacological cognitive training; Netherlands; Parkinson's not a mental disorder
37985620,Unravelling the Self-Report Versus Proxy-Report Conundrum for Older Aged Care Residents: Findings from a Mixed-Methods Study.,OUT_OF_SCOPE,observational,OUT_OF_SCOPE:3,none,unanimous; observational quality-of-life measurement study
37963686,Effect of hyperbaric oxygen therapy combined with repetitive transcranial magnetic stimulation on vascular cognitive impairment: a randomised controlled trial protocol.,OUT_OF_SCOPE,protocol_only,OUT_OF_SCOPE:3,none,unanimous; protocol only; China; non-pharmacological
37903143,A film-based intervention to reduce child maltreatment among migrant and displaced families from Myanmar: Protocol of a pragmatic cluster randomized controlled trial.,OUT_OF_SCOPE,non-pharmacological,OUT_OF_SCOPE:3,none,unanimous; protocol only; non-pharmacological; not Canadian; not mental disorder treatment
37879378,Association between rare earth elements and depression: Evidence from pilot mice model of chronic unpredictable mild stress-induced depression and human studies of major depressive disorder.,OUT_OF_SCOPE,observational,OUT_OF_SCOPE:3,none,unanimous; observational/animal study; China
37879349,Strategies to improve the quality and usefulness of mental health trials in humanitarian settings.,OUT_OF_SCOPE,review/meta-analysis,OUT_OF_SCOPE:3,none,unanimous; commentary/discussion paper
37874090,Targeting Endogenous Mechanisms of Brain Resilience for the Treatment and Prevention of Alzheimer's Disease.,OUT_OF_SCOPE,review/meta-analysis,OUT_OF_SCOPE:3,none,unanimous; review paper; no primary trial results
37721991,Oral Cannabidiol Treatment in Two Postmenopausal Women with Osteopenia: A Case Series.,OUT_OF_SCOPE,observational,OUT_OF_SCOPE:3,none,unanimous; case series with 2 participants; not mental health
37709260,Evaluation of Montreal Cognitive Assessment (MoCA) Administered via Videoconference.,OUT_OF_SCOPE,observational,OUT_OF_SCOPE:3,none,unanimous; validation/measurement study; Israel
37683803,"Correlates of nonfatal overdose among treatment-seeking individuals with non-heroin opioid use disorder: Findings from a pragmatic, pan-Canadian, randomized control trial.",OUT_OF_SCOPE,secondary_analysis,OUT_OF_SCOPE:3,none,unanimous; secondary analysis of OPTIMA trial examining correlates of overdose; not primary trial results
37679733,Emerging adult perceptions of higher-risk cannabis consumption behaviours.,OUT_OF_SCOPE,observational,OUT_OF_SCOPE:3,none,unanimous; observational survey study; not a treatment trial
37678339,Therapeutic developments for valosin-containing protein mediated multisystem proteinopathy.,OUT_OF_SCOPE,review/meta-analysis,OUT_OF_SCOPE:3,none,unanimous; review paper; neuromuscular disease
37662611,Occupational Therapist-Led Mindfulness Training Program for Older Adults Living with Early Cognitive Decline in Primary Care: A Pilot Randomized Controlled Trial.,OUT_OF_SCOPE,non-pharmacological,OUT_OF_SCOPE:3,none,unanimous; non-pharmacological mindfulness program; Canadian but not pharmacotherapy
37659086,Effectiveness of a web-based self-help tool to reduce problem gambling: A randomized controlled trial.,OUT_OF_SCOPE,non-pharmacological,OUT_OF_SCOPE:3,none,unanimous; non-pharmacological web-based intervention; Switzerland
37647498,The effect of vortioxetine on anhedonia in patients with schizophrenia.,OUT_OF_SCOPE,non-canadian,OUT_OF_SCOPE:3,none,unanimous; not Canadian; Croatia/Serbia
37623141,Nature Photographs as Complementary Care in Chemotherapy: A Randomized Clinical Trial.,OUT_OF_SCOPE,non-mental-health,OUT_OF_SCOPE:3,none,unanimous; cancer chemotherapy complementary care; Brazil; not mental health
37616239,"Effects of joint mobilization combined with acupuncture on pain, physical function, and depression in stroke patients with chronic neuropathic pain: A randomized controlled trial.",OUT_OF_SCOPE,non-pharmacological,OUT_OF_SCOPE:3,none,unanimous; non-pharmacological; Korea; stroke rehabilitation
37603539,Evidence- and data-driven classification of low back pain via artificial intelligence: Protocol of the PREDICT-LBP study.,OUT_OF_SCOPE,non-mental-health,OUT_OF_SCOPE:3,none,unanimous; protocol for classification study; not mental health treatment
37597507,Effects of Exercise on Structural and Functional Brain Patterns in Schizophrenia-Data From a Multicenter Randomized-Controlled Study.,OUT_OF_SCOPE,non-pharmacological,OUT_OF_SCOPE:3,none,unanimous; non-pharmacological exercise intervention; Germany
37467704,Long-term follow-up of phenobarbital versus valproate for generalized convulsive status epilepticus in adults: A randomized clinical trial.,OUT_OF_SCOPE,non-mental-health,OUT_OF_SCOPE:3,none,unanimous; epilepsy treatment; China; not a mental disorder
37461378,Cost-Effectiveness of Group Transdiagnostic Cognitive Behavioural Therapy for Anxiety Disorders in Primary Care Settings: Economic Evaluation From the Healthcare System Perspective Over a 1-Year Time Horizon.,OUT_OF_SCOPE,non-pharmacological,OUT_OF_SCOPE:3,none,unanimous; economic evaluation of non-pharmacological CBT; Canadian but not pharmacotherapy
37461125,Impairment of health-related quality of life for children with acute lymphoblastic leukemia over the first year of therapy: A report from the DFCI ALL Consortium.,OUT_OF_SCOPE,non-mental-health,OUT_OF_SCOPE:3,none,unanimous; pediatric leukemia QoL study; not mental health
37382748,Single and Combined Effects of Multiple Intensities of Behavioral Modification and Methylphenidate for Children with ADHD in the Home Setting.,OUT_OF_SCOPE,non-canadian,OUT_OF_SCOPE:3,none,unanimous; US-only summer treatment program; no Canadian sites
37353795,A multi-site pilot randomized clinical trial of the Treatment and Education Approach for Childhood-onset Lupus (TEACH) program: study design and COVID-19 adaptations.,OUT_OF_SCOPE,non-mental-health,OUT_OF_SCOPE:3,none,unanimous; CBT for lupus fatigue/mood; not pharmacological; lupus not a mental disorder
37310167,Local versus radical surgery for early rectal cancer with or without neoadjuvant or adjuvant therapy.,OUT_OF_SCOPE,review/meta-analysis,OUT_OF_SCOPE:3,none,unanimous; Cochrane systematic review; cancer surgery; not mental health
37301225,Feasibility and Effects of Namaste Care for Persons with Advanced Dementia in Canadian Long-Term Care Homes.,OUT_OF_SCOPE,non-pharmacological,OUT_OF_SCOPE:3,none,unanimous; pre-post study design (not RCT); non-pharmacological intervention
37260456,Clinical trial simulations in pulmonary fibrosis: patient-focused insights and adaptations.,OUT_OF_SCOPE,non-mental-health,OUT_OF_SCOPE:3,none,unanimous; clinical trial methodology study; pulmonary fibrosis
37218291,Pro-inflammatory markers are associated with response to sequential pharmacotherapy in major depressive disorder: a CAN-BIND-1 report.,UNCERTAIN,depression,"UNCERTAIN:2,MAP:1",minor,CAN-BIND-1 report; Canadian multi-site trial; escitalopram +/- aripiprazole for MDD; pharmacological; but open-label design; need full text to confirm if this represents primary or secondary results
37178546,Effect of yoga-based lifestyle and dietary modification in overweight individuals with sleep apnea: A randomized controlled trial (ELISA).,OUT_OF_SCOPE,non-mental-health,OUT_OF_SCOPE:3,none,unanimous; yoga for sleep apnea; India; not mental health
37170067,A machine learning approach towards the differentiation between interoceptive and exteroceptive attention.,OUT_OF_SCOPE,observational,OUT_OF_SCOPE:3,none,unanimous; machine learning neuroimaging analysis; not a treatment trial
37169708,Virtually-Delivered Emotion Focused Mindfulness Therapy (EFMT) Group vs. Wait-List Control for Late-Life Anxiety: A Randomized Controlled Trial.,OUT_OF_SCOPE,non-pharmacological,OUT_OF_SCOPE:3,none,unanimous; non-pharmacological mindfulness therapy; Canadian but not pharmacotherapy
36993778,"Effects of transcranial direct current stimulation (tDCS) in ""Kiss nightclub fire"" patients with post-traumatic stress disorder (PTSD): A phase II clinical trial.",OUT_OF_SCOPE,non-pharmacological,OUT_OF_SCOPE:3,none,unanimous; non-pharmacological neurostimulation; Brazil
36895006,The Building Emotional Awareness and Mental health (BEAM) program developed with a community partner for mothers of infants: protocol for a feasibility randomized controlled trial.,OUT_OF_SCOPE,protocol_only,OUT_OF_SCOPE:3,none,unanimous; protocol only; non-pharmacological mobile health program
37069446,"Sexual self-concept, functioning, and practices of women with binge eating episodes.",OUT_OF_SCOPE,observational,OUT_OF_SCOPE:3,none,unanimous; cross-sectional observational study; not a treatment trial
