id,title,decision,category,notes
row_6150,Evaluation of different methods of environmental enrichment to control anxiety in dogs undergoing hemilaminectomy after acute intervertebral disc extrusion: a randomized double-blinded study,OUT_OF_SCOPE,not_mh,No MH diagnosis
row_6151,Avatar Intervention for Cannabis Use Disorder in a Patient with Schizoaffective Disorder: A Case Report,OUT_OF_SCOPE,not_canadian,No Canadian site/PI
36919309,Feasibility of a Modified Otago Exercise Program for Older Adults With Cognitive Vulnerability,OUT_OF_SCOPE,non_pharma,Non-pharmacological intervention
row_6153,Empowering Self-Critical Perfectionistic Students: A Waitlist Controlled Feasibility Trial of an Explanatory Feedback Intervention on Daily Coping Processes,OUT_OF_SCOPE,non_pharma,Non-pharmacological intervention
row_6154,Efficacy of virtually-delivered Qigong/Tai Chi for depression in middle- and older-age adults with bipolar disorder (QT-BD): A pilot randomized controlled trial during the COVID-19 pandemic,OUT_OF_SCOPE,non_pharma,Non-pharmacological intervention
row_6155,"Diagnosis, Verdict, Conclusion, and Causality",OUT_OF_SCOPE,not_mh,No MH diagnosis
row_6156,The effect of sleep disorders on dementia risk in patients with traumatic brain injury: A large-scale cohort study,OUT_OF_SCOPE,not_mh,No MH diagnosis
row_6157,Examining the Effects of Nature and Animal Videos on Stress,OUT_OF_SCOPE,non_pharma,Non-pharmacological intervention
row_6158,Advancing Alzheimer’s care: a novel therapy with lecanemab,OUT_OF_SCOPE,not_mh,No MH diagnosis
row_6159,Multivariable prediction of functional outcome after first-episode psychosis: a crossover validation approach in EUFEST and PSYSCAN,OUT_OF_SCOPE,not_rct,No RCT design
39288539,New frontiers in the biosynthesis of psychoactive specialized metabolites,OUT_OF_SCOPE,not_canadian,No Canadian site/PI
row_6161,"The Effect of Video Camera, Microphone and Chat Box Use on Social Presence and Engagement in an Online Group Activity",OUT_OF_SCOPE,not_mh,No MH diagnosis
39136257,Deep brain stimulation for Tourette's syndrome,OUT_OF_SCOPE,review,Cochrane review
38394113,Technology and physical activity for preventing cognitive and physical decline in older adults: Protocol of a pilot RCT,OUT_OF_SCOPE,protocol_no_results,Protocol without results
row_6164,Reducing Suicide Ideation in Transgender Adolescents with Mindful Self-Compassion: An Open Trial,OUT_OF_SCOPE,non_pharma,Non-pharmacological intervention
39122565,Exploration of Alzheimer's disease-related gene expression following high-intensity and moderate-intensity exercise interventions,OUT_OF_SCOPE,not_mh,No MH diagnosis
row_6166,Clinical value of Alzheimer's disease biomarker testing,OUT_OF_SCOPE,not_mh,No MH diagnosis
39562453,Mismatch Negativity (MMN) as a Pharmacodynamic/Response Biomarker for NMDA Receptor and Excitatory/Inhibitory Imbalance-Targeted Treatments in Schizophrenia,OUT_OF_SCOPE,non_pharma,Non-pharmacological intervention
39396702,Maternal high-dose docosahexaenoic acid supplementation and neurodevelopment at 5 Years of preterm children,OUT_OF_SCOPE,not_mh,No MH diagnosis
39481094,Effectiveness of King’s Theory of Goal Attainment in Blood Glucose Management for Newly Diagnosed Patients With Type 2 Diabetes: Randomized Controlled Trial,OUT_OF_SCOPE,not_mh,No MH diagnosis
38423771,Digital computerised cognitive training for preventing cognitive decline among hypertensive patients: a study protocol for a multicentre randomised controlled trial (DELIGHT trial),OUT_OF_SCOPE,not_mh,No MH diagnosis
38965832,Real-world performance of plasma p-tau181 in a heterogeneous memory clinic cohort,OUT_OF_SCOPE,not_mh,No MH diagnosis
38706275,China Initiative for Multi-Domain Intervention (CHINA-IN-MUDI) to Prevent Cognitive Decline: Study Design and Progress,OUT_OF_SCOPE,not_mh,No MH diagnosis
row_6173,"Evaluating an EEG-based tool for assessing acute clinical and cognitive changes in adult outpatients with MDD treated with open-label, flexible-dose vortioxetine: A pilot study",OUT_OF_SCOPE,not_rct,Non-randomized
38834317,European Autism GEnomics Registry (EAGER): Protocol for a multicentre cohort study and registry,OUT_OF_SCOPE,not_mh,No MH diagnosis
row_6175,A bibliometric analysis on the health behaviors related to mild cognitive impairment,OUT_OF_SCOPE,review,Review/meta-analysis
row_6176,High performing male and female engineering students in Chile: accounting for mental health and well-being from a developmental paradigm,OUT_OF_SCOPE,not_mh,No MH diagnosis
row_6177,The Crucial Role of Psychosocial Factors in Cardiovascular Health and Illness: A Position Paper,OUT_OF_SCOPE,not_mh,No MH diagnosis
row_6178,Augmentative and alternative communication in autism spectrum disorder: transitioning from letter board to iPad – a case study,OUT_OF_SCOPE,non_pharma,Non-pharmacological intervention
row_6179,Circulating Cell-Free Mitochondrial DNA in Plasma of Individuals with Schizophrenia and Cognitive Deficit in Mexican Population,OUT_OF_SCOPE,not_rct,No RCT design
39402817,Effect of Relaxation-Based Virtual Reality on Psychological and Physiological Stress of Substance Abusers Under Detoxification: A Randomized Controlled Trial,OUT_OF_SCOPE,not_mh,No MH diagnosis
row_6181,Rational design of structure-based vaccines targeting misfolded alpha-synuclein conformers of Parkinson's disease and related disorders,OUT_OF_SCOPE,animal_study,Animal study
row_6182,"Effectiveness of Mindfulness-Based Art Therapy (MBAT) Utilizing Watercolor Painting on Emotion Regulation, Mindfulness, and Obsessive Symptoms",OUT_OF_SCOPE,non_pharma,Non-pharmacological intervention
row_6183,"Connectedness, feeling At home, and joyful Play (CAP): A place-based wellness model for cognitive health promotion in the community by the community",OUT_OF_SCOPE,not_mh,No MH diagnosis
38381069,Uncovering Structure-Activity Relationships of Phenethylamines: Paving the Way for Innovative Mental Health Treatments,OUT_OF_SCOPE,not_canadian,No Canadian site/PI
38689456,Event-Related Potential Changes Following 12-week Yoga Practice in T2DM Patients: A Randomized Controlled Trial,OUT_OF_SCOPE,not_mh,No MH diagnosis
39526905,"Virtual reality exposure therapy for sexual aversion: A proof-of-concept study on acceptability, adequacy, and clinical effects",OUT_OF_SCOPE,not_mh,No MH diagnosis
row_6187,Development of the treatment prediction model in the artificial intelligence in depression – medication enhancement study,OUT_OF_SCOPE,not_canadian,No Canadian site/PI
40015077,Efficacy of integrated social cognitive remediation vs neurocognitive remediation in schizophrenia: Results from the multicenter randomized controlled ISST (Integrated Social Cognition And Social Skills Therapy) study,OUT_OF_SCOPE,non_pharma,Non-pharmacological intervention
40311178,"The difficult inpatient, prevalence and characteristics",OUT_OF_SCOPE,not_rct,Observational/non-RCT
40055696,Effects of transcranial direct current stimulation combined with retrieval practice on semantic memory in patients with schizophrenia,OUT_OF_SCOPE,not_rct,Observational/non-RCT
39791866,Seltorexant for major depressive disorder,OUT_OF_SCOPE,not_canadian,No Canadian site/PI
39569914,Low-Frequency Deep Brain Stimulation in Non-Rapid Eye Movement Sleep Modifies Memory Retention in Parkinson's Disease,OUT_OF_SCOPE,not_mh,No MH diagnosis
40456393,Neurocognitive effects of psilocybin: A systematic and comprehensive review of neuroimaging studies in humans,OUT_OF_SCOPE,not_canadian,No Canadian site/PI
40032291,Mortality risk among people receiving acute hospital care for hallucinogen use compared with the general population,OUT_OF_SCOPE,not_rct,Observational/non-RCT
row_6195,Potential Role of Lymphovenous Bypass in Mitigating Alzheimer's Disease Dementia,OUT_OF_SCOPE,not_mh,No MH diagnosis
41537478,Effects of Electronic Sports on Community-Dwelling Older Adults With Mild Cognitive Impairment: A Randomized Controlled Study,OUT_OF_SCOPE,non_pharma,Non-pharmacological intervention
row_6197,"Patient-Centered Cardiac Surgery: Psychosocial Challenges, Evidence-Based Interventions, and Future Horizons",OUT_OF_SCOPE,non_pharma,Non-pharmacological intervention
39984005,A panel of altered blood oxysterols in patients with mild cognitive impairment: A novel combined diagnostic marker,OUT_OF_SCOPE,not_mh,No MH diagnosis
41002329,POC Sensor Systems and Artificial Intelligence—Where We Are Now and Where We Are Going?,OUT_OF_SCOPE,not_mh,No MH diagnosis
41303365,Perturbations of Zinc Homeostasis and Onset of Neuropsychiatric Disorders.,OUT_OF_SCOPE,not_canadian,No Canadian site/PI
41296368,Therapeutic Use of Cannabis and Cannabinoids: A Review.,OUT_OF_SCOPE,review,JAMA review of cannabis therapeutics
41237789,Cognitive changes in older adults receiving pharmacotherapy for treatment-resistant depression: a secondary analysis of the OPTIMUM randomised controlled trial.,OUT_OF_SCOPE,secondary_analysis,OPTIMUM trial secondary analysis of cognition
41226860,Effectiveness of Photobiomodulation to Treat Motor and Non-Motor Symptoms of Parkinson's Disease: A Randomised Clinical Trial with Extended Treatment.,OUT_OF_SCOPE,not_mh,No MH diagnosis
41220071,Ventilatory stimulation with relative external dead space loading does not impact sex differences in exertional dyspnoea.,OUT_OF_SCOPE,not_mh,No MH diagnosis
41218611,Semaglutide for the treatment of cognitive dysfunction in major depressive disorder: A randomized clinical trial.,OUT_OF_SCOPE,non_pharma,Non-pharmacological intervention
41053410,Can you beat the music? Validation of a gamified rhythmic training in children with ADHD.,OUT_OF_SCOPE,non_pharma,Gamified rhythmic training for ADHD - non-pharma
40986433,Implication for Clinical Trials From Longitudinal Tau-PET Accumulation Across Biological Alzheimer Disease Stages.,OUT_OF_SCOPE,not_mh,No MH diagnosis
40985290,The relationship of soluble tau species with Alzheimer's disease amyloid plaque removal and tau pathology.,OUT_OF_SCOPE,not_mh,No MH diagnosis
40976313,Omega-3 polyunsaturated fatty acids in neurodegenerative disorders: Mixed designs = mixed results.,OUT_OF_SCOPE,not_mh,No MH diagnosis
40962221,Quality of Life in Adults With Transposition of the Great Arteries With a Systemic Right or Left Ventricle.,OUT_OF_SCOPE,not_rct,Observational/non-RCT
40922004,LGBTQ + Affirmative CBT: a hierarchical linear model of longitudinal outcomes and mechanisms of change.,OUT_OF_SCOPE,not_rct,Observational/non-RCT
40919724,Opioid agonist therapy for opioid use disorder in primary versus specialty care.,OUT_OF_SCOPE,review,Cochrane review
40899991,Trajectories of Incarceration Over Six Years Among People with Mental Illness and Experiences of Homelessness: Predictive Factors Among Participants in a Randomized Trial of Housing First: Trajectoires d'incarcération sur six ans chez les personnes atteintes de maladie mentale et ayant connu l'itinérance-Facteurs prédictifs chez les participants à un essai à répartition aléatoire en marge du programme «Logement d'abord».,OUT_OF_SCOPE,not_mh,No MH diagnosis
40898247,"A collaborative primary and mental health care model with psychologist and psychiatrist working in GP practices: process evaluation of the implementation, challenges, and sustainability.",OUT_OF_SCOPE,not_mh,No MH diagnosis
40892412,Measurement-Based Care to Enhance Antidepressant Treatment Outcomes in Major Depressive Disorder: A Randomized Clinical Trial.,OUT_OF_SCOPE,not_canadian,No Canadian site/PI
40887513,A Randomized-Controlled Trial Examining Telephone-Based Cognitive Behavioral Therapy for Patients After Metabolic and Bariatric Surgery: 18 Month Follow-up Results.,OUT_OF_SCOPE,non_pharma,Non-pharmacological intervention
40883451,"Intermittent theta burst stimulation for non-suicidal self-injury in adolescents with major depressive disorder: a randomized, sham-controlled trial.",OUT_OF_SCOPE,non_pharma,Non-pharmacological intervention
40868438,Immediate Skin-to-Skin Contact at Very Preterm Birth and Neurodevelopment the First Two Years: Secondary Outcomes from a Randomised Clinical Trial.,OUT_OF_SCOPE,non_mh_primary,Primary condition not MH
40875502,"Lumateperone as Adjunctive Therapy in Patients With Major Depressive Disorder: Results From a Randomized, Double-Blind, Phase 3 Trial.",OUT_OF_SCOPE,not_canadian,No Canadian site/PI
40856999,Poststroke Cardiorespiratory Exercise for Brain Volume and Cognition: A Randomized Clinical Trial.,OUT_OF_SCOPE,not_mh,No MH diagnosis
40852147,Effects of adjunctive brexpiprazole in patients with major depressive disorder and sleep disturbance: a post hoc analysis of three randomized trials.,OUT_OF_SCOPE,not_canadian,No Canadian site/PI
40844852,AASLD AST Practice Guideline on adult liver transplantation: Diagnosis and management of graft-related complications.,OUT_OF_SCOPE,not_mh,No MH diagnosis
40838518,Cognitive outcomes of deep brain stimulation depend on age and hippocampal connectivity in Parkinson's and Alzheimer's disease.,OUT_OF_SCOPE,not_mh,No MH diagnosis
40796830,Suicidality among people with mild cognitive impairment: a sustematic review.,OUT_OF_SCOPE,non_pharma,Non-pharmacological intervention
40774114,A randomised pilot study comparing brief psychodynamic therapy with cognitive-behavioural therapy in the treatment of patients with fibromyalgia.,OUT_OF_SCOPE,non_mh_primary,Primary condition not MH
40768609,Cognitive preservation and antidepressant efficacy of magnetic seizure therapy in adolescents with treatment resistant major depressive disorder in China: A randomized controlled trial.,OUT_OF_SCOPE,not_canadian,Chinese MST vs MECT for TRD
40766010,Healing Hearts Together - an emotionally focused intervention for couples after a cardiac event: a randomized controlled trial protocol.,OUT_OF_SCOPE,not_mh,No MH diagnosis
40746110,Randomised controlled trial of clozapine in resistant schizophrenia and schizoaffective disorder.,OUT_OF_SCOPE,not_canadian,Spanish clozapine for TRS/SZD
40713415,Home-based cognitive remediation and transcranial direct current stimulation to enhance cognition in older adults with major depressive disorder or mild cognitive impairment: An open label study.,OUT_OF_SCOPE,non_pharma,Non-pharmacological intervention
40694950,"Unraveling the policies, legislations, and regulations of psychedelics in Australia, Canada, Netherlands, New Zealand, and India.",OUT_OF_SCOPE,review,Policy/legislation review of psychedelics
40679466,Safety and Efficacy of Telemedicine for Patients With Advanced Cancer in the Outpatient Setting: Lessons Learned From a Pilot Trial.,OUT_OF_SCOPE,non_mh_primary,Primary condition not MH
40660741,Regional effects of gantenerumab on neuroimaging biomarkers in the DIAN-TU-001 trial.,OUT_OF_SCOPE,not_mh,No MH diagnosis
40614562,Understanding caffeine's impact on sustained attention in early phase psychosis: Unveiling cognitive insights through the use of EEG.,OUT_OF_SCOPE,not_canadian,No Canadian site/PI
40607608,The Therapeutic Effects of Acorus Tatarinowii Volatile Oil and Electroacupuncture in Post-Stroke Cognitive Impairment Patients: A Clinical Trial Protocol.,OUT_OF_SCOPE,not_mh,No MH diagnosis
40584209,Effects of Binaural Beat Music and Esketamine for ECT in the Treatment of Major Depressive Disorder: A Randomized Controlled Trial Protocol.,OUT_OF_SCOPE,protocol_no_results,Protocol without results
40583799,Harnessing greater statistical power: Comprehensive evaluation of disease modifying treatment effects across all or multiple post-baseline visits compared to the last visit for Alzheimer's disease clinical trials.,OUT_OF_SCOPE,not_mh,No MH diagnosis
40555874,Effectiveness of an online mindfulness-based stress-reduction intervention to reduce anxiety in breast cancer survivors: a randomized-controlled trial.,OUT_OF_SCOPE,non_pharma,Non-pharmacological intervention
40534411,Moderators of antidepressant augmentation versus switch in the OPTIMUM randomised controlled trial.,OUT_OF_SCOPE,not_canadian,No Canadian site/PI
40520506,The change of MRI indexes of brain glymphatic function and sleep status before and after repeated transcranial magnetic stimulation in insomnia disorder patients.,OUT_OF_SCOPE,not_rct,No RCT design
40505671,Lithium as a disease-modifying drug for bipolar disorder.,OUT_OF_SCOPE,not_rct,Observational/non-RCT
40480970,The electroencephalography protocol for the Accelerating Medicines Partnership® Schizophrenia Program: Reliability and stability of measures.,OUT_OF_SCOPE,protocol_no_results,Protocol without results
40457257,Building Emotional Awareness and Mental Health (BEAM): study protocol for a hybrid implementation-effectiveness trial of the BEAM app-based program for parents with clinical mental health problems.,OUT_OF_SCOPE,protocol_no_results,Protocol without results
40435792,Early improvement of psychopathological symptoms with add-on repetitive transcranial magnetic stimulation treatment as the key contributor to improving remission in schizophrenia.,OUT_OF_SCOPE,not_canadian,No Canadian site/PI
40423966,"Azetukalner, a Novel KV7 Potassium Channel Opener, in Adults With Major Depressive Disorder: A Randomized Clinical Trial.",OUT_OF_SCOPE,not_canadian,No Canadian site/PI
40421808,Restoring TADS: RIAT reanalysis of the Treatment for Adolescents with Depression Study.,OUT_OF_SCOPE,not_canadian,No Canadian site/PI
40402609,Emotions and climate change: The role of emotion regulation in climate action.,OUT_OF_SCOPE,not_mh,No MH diagnosis
40346702,Trauma-focused dialectical behavior therapy: study protocol for a randomized controlled multi-center trial in online and face-to-face formats.,OUT_OF_SCOPE,non_pharma,Non-pharmacological intervention
40337158,Safety considerations of semaglutide in the potential treatment of Alzheimer's disease: A pooled analysis of semaglutide in adults aged ≥ 65 years.,OUT_OF_SCOPE,not_mh,No MH diagnosis
40328824,Aquatic exercise versus standard care on paraspinal muscle morphology and function in chronic low back pain patients: a randomized controlled trial.,OUT_OF_SCOPE,non_pharma,Non-pharmacological intervention
40314247,"Comparing a novel, virtual, group-based guided self-help to unguided self-help for the treatment of binge-eating disorder in adults: a randomized controlled trial.",OUT_OF_SCOPE,non_pharma,Non-pharmacological intervention
40267585,Cannabidiol and cognitive functions/inflammatory markers in Parkinson's disease: A double-blind randomized controlled trial at Buriram Hospital (CBD-PD-BRH trial).,OUT_OF_SCOPE,non_mh_primary,Primary condition not MH
40257965,One-Day Online Cognitive Behavioral Therapy-Based Workshops for the Prevention of Postpartum Depression: A Randomized Controlled Trial.,OUT_OF_SCOPE,non_pharma,CBT workshops for PPD prevention
40209131,Automated Speech Analysis to Differentiate Frontal and Right Anterior Temporal Lobe Atrophy in Frontotemporal Dementia.,OUT_OF_SCOPE,not_mh,No MH diagnosis
40207988,Mechanistic evaluation of ertugliflozin in patients with type 2 diabetes and heart failure.,OUT_OF_SCOPE,not_mh,No MH diagnosis
40150477,Effects of Integrating Pain Coping Strategies into Occupational Therapy After Total Knee Arthroplasty: A Parallel Mixed-Method Study.,OUT_OF_SCOPE,non_mh_primary,Pain coping OT after knee arthroplasty - orthopedic
40150174,"""VID-KIDS"" Video-Feedback Interaction Guidance for Depressed Mothers and Their Infants: Results of a Randomized Controlled Trial.",OUT_OF_SCOPE,non_pharma,Non-pharmacological intervention
40148993,Cognitive impairment in systemic lupus erythematosus patients: prevalence and its association with quality of life.,OUT_OF_SCOPE,not_rct,Observational/non-RCT
40124957,An Acceptance-Based Guided Self-Help Program for Weight Loss Maintenance in Adults Who Have Previously Completed a Behavioral Weight Loss Program: The SWiM Feasibility Study.,OUT_OF_SCOPE,not_mh,No MH diagnosis
40108576,STORCH Brazil: multicenter cohort study protocol to investigate neurodevelopmental paths and functioning in infants exposed to STORCH in Brazil.,OUT_OF_SCOPE,not_mh,No MH diagnosis
40086906,Cognitive remediation for patients with late-life schizophrenia: A follow-up pilot study.,OUT_OF_SCOPE,non_pharma,Non-pharmacological intervention
40086221,Effect of bright light therapy on depression in patients with schizophrenia: A pilot study.,OUT_OF_SCOPE,not_rct,No RCT design
40081590,Kynurenine pathway metabolites predict antianhedonic effects of electroconvulsive therapy in patients with treatment-resistant depression.,OUT_OF_SCOPE,not_rct,Non-randomized
40077139,The Effect of Leisure-Time Exercise on Mental Health Among Adults: A Bibliometric Analysis of Randomized Controlled Trials.,OUT_OF_SCOPE,review,Review/meta-analysis
40075340,Transdiagnostic internet cognitive behavioural therapy for anxiety and depressive symptoms in postnatal women: protocol of a randomized controlled trial.,OUT_OF_SCOPE,protocol_no_results,Protocol without results
40049292,Effects of virtual reality mindfulness on cognition and well-being in ALS: A randomized trial protocol.,OUT_OF_SCOPE,protocol_no_results,Protocol without results
40024242,Effects of Wearing Hearing Aids on Gait and Cognition: A Pilot Study.,OUT_OF_SCOPE,not_mh,No MH diagnosis
40015754,Protocol for an intergenerational randomized controlled trial to enhance physical activity in older adults at risk for Alzheimer's disease.,OUT_OF_SCOPE,not_mh,No MH diagnosis
40014356,Online Intervention for Muscle Tension Dysphonia: A Pilot Randomized Clinical Trial.,OUT_OF_SCOPE,non_pharma,Non-pharmacological intervention
40012166,Acute subanesthetic ketamine-induced effects on the mismatch negativity and their relationship to early and sustained treatment response in major depressive disorder.,OUT_OF_SCOPE,not_rct,Non-randomized
40011816,"Prevalence and correlates of depressive and anxiety symptoms among pregnant women from an urban informal settlement in Nairobi, Kenya: a community-based cross-sectional study.",OUT_OF_SCOPE,non_pharma,Non-pharmacological intervention
40010812,Narrative enhancement and cognitive therapy for self-stigma among youth with bipolar disorder or multiple mental health conditions: protocol for a pilot randomised basket trial.,OUT_OF_SCOPE,protocol_no_results,Protocol without results
40009046,Sequencing Stimulant Medication and Behavioral Parent Training in Multiplex ADHD Families: A Pilot SMART.,OUT_OF_SCOPE,non_pharma,Non-pharmacological intervention
39991529,Prospective observational study to evaluate the feasibility of the mobile app for mild cognitive impairment detection and screening.,OUT_OF_SCOPE,not_mh,No MH diagnosis
39979051,"Impact of an acute 1-month cannabidiol treatment on pain and inflammation after a long bone fracture: a triple-blind randomised, placebo-controlled, clinical trial protocol.",OUT_OF_SCOPE,protocol_no_results,Protocol without results
39970426,Cost Utility Analysis of Internet-Based Cognitive Behavioral Therapy for Major Depressive Disorder: Randomized Controlled Trial.,OUT_OF_SCOPE,non_pharma,Non-pharmacological intervention
39960888,Impact of intravenous laser irradiation of blood on cognitive function and molecular pathways in long COVID patients: a pilot study.,OUT_OF_SCOPE,not_mh,No MH diagnosis
39953407,Strengthening the delivery of integrated care for individuals experiencing serious mental illness within mental health settings: a qualitative description of health provider perspectives.,OUT_OF_SCOPE,not_mh,No MH diagnosis
39941429,Music-Based Cognitive Training for Adults with Major Depressive Disorder and Suicide Risk: A Pilot Study.,OUT_OF_SCOPE,non_pharma,Non-pharmacological intervention
39935882,Effect of Tai Chi combined with music therapy on the cognitive function in older adult individuals with mild cognitive impairment.,OUT_OF_SCOPE,not_mh,No MH diagnosis
39924959,SleepNow - A combined cognitive behavioral therapy for insomnia and physical exercise intervention in men with metastatic prostate cancer: results from a feasibility randomized controlled trial.,OUT_OF_SCOPE,non_mh_primary,Primary condition not MH
39924464,Personalized chat-based support for smoking cessation among smokers with mental health symptoms in the workplace: A randomized controlled trial.,OUT_OF_SCOPE,non_pharma,Non-pharmacological intervention
39914462,Professorships in child and adolescent psychiatry relative to a similarly sized medical specialty in the UK and Ireland: cross-sectional study.,OUT_OF_SCOPE,not_mh,No MH diagnosis
39848569,Long-Term Mental Health Morbidity in Adult Survivors of COVID-19 Critical Illness: A Population-Based Cohort Study.,OUT_OF_SCOPE,not_rct,Observational/non-RCT
39836613,"Comment on: In clinical hand osteoarthritis research, self-reported pain questionnaires do not reflect the patient experience",OUT_OF_SCOPE,non_mh_primary,Primary condition not MH
39833671,A mobile-based multidomain lifestyle intervention using Cognitive Evergreenland for older adults with subjective cognitive decline: a feasibility study.,OUT_OF_SCOPE,not_mh,No MH diagnosis
39825184,Safety and Efficacy of Deutetrabenazine at High versus Lower Daily Dosages in the ARC-HD Study to Treat Chorea in Huntington Disease.,OUT_OF_SCOPE,not_mh,No MH diagnosis
39823487,Effect of Lemborexant on Daytime Functioning in Adults With Insomnia: Patient-Reported Outcomes From a Phase 3 Clinical Trial.,OUT_OF_SCOPE,not_mh,No MH diagnosis
39810453,A Mobile App-Based Gratitude Intervention's Effect on Mental Well-Being in University Students: Randomized Controlled Trial.,OUT_OF_SCOPE,non_pharma,Non-pharmacological intervention
39775036,Temporal trends in mental health terminology in Alzheimer's disease clinical trials.,OUT_OF_SCOPE,not_rct,Observational/non-RCT
39766492,Effects of Extremely Low-Frequency Electromagnetic Field Treatment on ASD Symptoms in Children: A Pilot Study.,OUT_OF_SCOPE,non_pharma,Non-pharmacological intervention
