id,title,decision,category,notes
37314666,Influence of a Brief Autism Education Intervention on Peer Engagement and Inclusion At Mainstream Day Camps: A Mixed-Methods Pilot Study.,OUT_OF_SCOPE,not_mh,No MH diagnosis
37303044,Moxibustion treatment for Parkinson's disease: study protocol for a randomized controlled trial.,OUT_OF_SCOPE,protocol_no_results,Protocol without results
37245533,A feasibility study of the combination of intranasal insulin with dulaglutide for cognition in older adults with metabolic syndrome at high dementia risk - Study rationale and design.,OUT_OF_SCOPE,not_mh,No MH diagnosis
37239811,Absence of Depressive and Anxious Behavior with Genetic Dysregulation in Adult C57Bl/6J Mice after Prenatal Exposure to Ionizing Radiation.,OUT_OF_SCOPE,animal_study,Animal study
37239244,Sleep Architecture and EEG Power Spectrum Following Cumulative Sleep Restriction: A Comparison between Typically Developing Children and Children with ADHD.,OUT_OF_SCOPE,non_pharma,Non-pharmacological intervention
37231221,A Preliminary Examination of the Effects and Mechanisms of Cognitive Behavioral Therapy for Insomnia on Systemic Inflammation Among Patients with Knee Osteoarthritis.,OUT_OF_SCOPE,non_mh_primary,Primary condition not MH
37203362,Is the use of bipolar hemiarthroplasty over monopolar hemiarthroplasty justified? A propensity score-weighted analysis of a multicentre randomized controlled trial.,OUT_OF_SCOPE,not_mh,No MH diagnosis
36288364,Virtually-delivered Sudarshan Kriya Yoga (SKY) for Canadian veterans with PTSD: A study protocol for a nation-wide effectiveness and implementation evaluation.,OUT_OF_SCOPE,protocol_no_results,Protocol without results
37100187,The Seventh Prevention of Syncope Trial (POST VII)-A randomized clinical trial of atomoxetine for the prevention of vasovagal syncope: Rationale and study design.,OUT_OF_SCOPE,not_mh,No MH diagnosis
36653167,Predictors of treatment attrition of cognitive health interventions in first episode psychosis.,OUT_OF_SCOPE,non_pharma,Non-pharmacological intervention
36173066,"Sleep Disturbance, Irritability, and Response to Lurasidone Treatment in Children and Adolescents with Bipolar Depression.",OUT_OF_SCOPE,not_rct,Observational/non-RCT
34184620,Internet-delivered cognitive processing therapy for individuals with a history of bullying victimization: a randomized controlled trial.,OUT_OF_SCOPE,non_pharma,Non-pharmacological intervention
34868484,Online narrative exposure therapy for parents of children with neurodevelopmental disabilities suffering from posttraumatic stress symptoms - study protocol of a randomized controlled trial.,OUT_OF_SCOPE,protocol_no_results,Protocol without results
35505312,Findings from a pilot open-label trial of N-acetylcysteine for the treatment of pediatric mania and hypomania.,OUT_OF_SCOPE,non_pharma,Non-pharmacological intervention
35996823,Caring Contacts to Reduce Psychiatric Morbidity Following Hospitalization During the COVID-19 Pandemic: A Pilot Randomized Controlled Trial.,OUT_OF_SCOPE,non_pharma,Non-pharmacological intervention
37119742,Patient feedback and psychosocial outcomes of deep brain stimulation in people with obsessive-compulsive disorder.,OUT_OF_SCOPE,non_pharma,Non-pharmacological intervention
36520318,"Early Morning ADHD Symptoms and Functional Impairment: Impact on Patients and Caregivers, and Pharmacological Approaches to Management.",OUT_OF_SCOPE,not_rct,No RCT design
37047933,Efficacy of an Online Workplace Mental Health Accommodations Psychoeducational Course: A Randomized Controlled Trial.,OUT_OF_SCOPE,non_pharma,Non-pharmacological intervention
36925892,"""There is always a waitlist"": The experiences of perinatal women randomized to a waitlist condition in a trial evaluating a novel online self-directed intervention for perinatal anxiety.",OUT_OF_SCOPE,non_pharma,Non-pharmacological intervention
36787672,Predictors of perceived symptom change with acute cannabis use for mental health conditions in a naturalistic sample: A machine learning approach.,OUT_OF_SCOPE,not_canadian,No Canadian site/PI
36097565,"The Efficacy of Integrated Rehabilitation for Post-Stroke Anxiety: Study Protocol for a Prospective, Multicenter, Randomized Controlled Trial.",OUT_OF_SCOPE,not_mh,No MH diagnosis
35896153,Immature defense mechanisms predict poor response to psychotherapy in major depressive patients with comorbid cluster B personality disorder.,OUT_OF_SCOPE,non_pharma,Non-pharmacological intervention
33242924,Genetic counselling for the prevention of mental health consequences of cannabis use: A randomized controlled trial-within-cohort.,OUT_OF_SCOPE,not_canadian,No Canadian site/PI
35306862,Economic Evaluation of Early Psychosis Interventions From A Canadian Perspective.,OUT_OF_SCOPE,non_pharma,Non-pharmacological intervention
