id,title,final_decision,category,vote_count,conflict_flag,reconciliation_notes
35594873,Brain atrophy in prodromal synucleinopathy is shaped by structural connectivity and gene expression.,OUT_OF_SCOPE,non-RCT,3/3,FALSE,Unanimous agreement
35596975,Can AI make people happy? The effect of AI-based chatbot on smile and speech in Parkinson's disease,OUT_OF_SCOPE,non-pharmacological,3/3,FALSE,Unanimous agreement
35637185,"Correction: Clinical utility of combinatorial pharmacogenomic testing in depression: A Canadian patient- and rater-blinded, randomized, controlled trial",MAP,pharmacological_mental_health,3/3,FALSE,Unanimous agreement; category tiebreak by E1
35678397,Alzheimer Disease,OUT_OF_SCOPE,review,3/3,FALSE,Unanimous agreement
35718233,Physical exercise and the functions of microRNAs.,OUT_OF_SCOPE,review,3/3,FALSE,Unanimous agreement
35963072,"Effects of an integrated childbirth education program to reduce fear of childbirth, anxiety, and depression, and improve dispositional mindfulness: A single-blind randomised controlled trial.",OUT_OF_SCOPE,non-pharmacological,3/3,FALSE,Unanimous agreement
36122378,Effectiveness of an Unsupervised Online Yoga Program on Pain and Function in People With Knee Osteoarthritis: A Randomized Clinical Trial.,OUT_OF_SCOPE,non-mental-health,3/3,FALSE,Unanimous agreement
36263513,"Culture, context, and ethics in the therapeutic use of hallucinogens: Psychedelics as active super-placebos?",OUT_OF_SCOPE,review,3/3,FALSE,Unanimous agreement
36422517,Meditation and Yoga for Irritable Bowel Syndrome: A Randomized Clinical Trial.,OUT_OF_SCOPE,non-pharmacological,3/3,FALSE,Unanimous agreement
36986229,Supplementation with Flaxseed Oil Rich in Alpha-Linolenic Acid Improves Verbal Fluency in Healthy Older Adults,OUT_OF_SCOPE,non-mental-health,3/3,FALSE,Unanimous agreement
37009976,A Path to Improved Alzheimer's Care: Simulating Long-Term Health Outcomes of Lecanemab in Early Alzheimer's Disease from the CLARITY AD Trial.,OUT_OF_SCOPE,non-RCT,3/3,FALSE,Unanimous agreement
37821461,Metformin improves cognitive impairment in patients with schizophrenia: associated with enhanced functional connectivity of dorsolateral prefrontal cortex,OUT_OF_SCOPE,non-Canadian,2/3,TRUE,Majority rule; dissent: E2=UNCERTAIN
37903365,Clinical Effectiveness of Cognitively Enhanced Tai Ji Quan Training on Global Cognition and Dual-Task Performance During Walking in Older Adults With Mild Cognitive Impairment or Self-Reported Memory Concerns: A Randomized Controlled Trial.,OUT_OF_SCOPE,non-pharmacological,3/3,FALSE,Unanimous agreement
37936330,Vortioxetine for the treatment of post-COVID-19 condition: a randomized controlled trial.,MAP,pharmacological_mental_health,3/3,FALSE,Unanimous agreement; category tiebreak by E1
38105605,"Association of plasma biomarkers with cognition, cognitive decline, and daily function across and within neurodegenerative diseases: Results from the Ontario Neurodegenerative Disease Research Initiative",OUT_OF_SCOPE,non-RCT,3/3,FALSE,Unanimous agreement
38454079,Comparative effectiveness research trial for antidepressant incomplete and non-responders with treatment resistant depression (ASCERTAIN-TRD) a randomized clinical trial.,MAP,pharmacological_mental_health,2/3,TRUE,Majority rule; dissent: E2=UNCERTAIN; category tiebreak by E1
38760589,"p75 neurotrophin receptor modulation in mild to moderate Alzheimer disease: a randomized, placebo-controlled phase 2a trial.",UNCERTAIN,pharmacological_mental_health,3/3,FALSE,Unanimous agreement; category tiebreak by E1
38901423,Brain responses to intermittent fasting and the healthy living diet in older adults.,OUT_OF_SCOPE,non-pharmacological,3/3,FALSE,Unanimous agreement
39764567,"Effect of psilocybin versus escitalopram on depression symptom severity in patients with moderate-to-severe major depressive disorder: observational 6-month follow-up of a phase 2, double-blind, randomised, controlled trial.",OUT_OF_SCOPE,non-Canadian,3/3,FALSE,Unanimous agreement
rank_1488,Evaluation of the effectiveness and safety of olanzapine as an adjunctive treatment for anorexia nervosa in adolescents: An open-label trial,MAP,observational,2/3,TRUE,Majority rule; dissent: E1=OUT_OF_SCOPE; category tiebreak by E1
