id,title,final_decision,category,vote_count,conflict_flag,reconciliation_notes
Cognitive Changes in Older Adults Following a Step,Cognitive Changes in Older Adults Following a Stepped Care Intervention for Late-life Depression,OUT_OF_SCOPE,non-Canadian,2,N,Agreement
31147243,Social Support and Depression Related to Older Adults' Hypertension Control in Rural China.,OUT_OF_SCOPE,non-Canadian,2,N,Agreement
34583100,Body mass index and atypical balance as predictors of winter depression remission in cognitive-behavioral therapy and light therapy.,OUT_OF_SCOPE,non-Canadian,2,N,Agreement
32449010,A pilot investigation of accelerated deep transcranial magnetic stimulation protocols in treatment-resistant depression.,OUT_OF_SCOPE,non-Canadian,2,N,Agreement
27470429,A Comparison of Markov and Discrete-Time Microsimulation Approaches: Simulating the Avoidance of Alcohol-Attributable Harmful Events from Reduction of Alcohol Consumption Through Treatment of Alcohol Dependence.,OUT_OF_SCOPE,non-pharma,2,N,Agreement
32792940,The Validation of Multifactor Model of Plasma Aβ 42 and Total-Tau in Combination With MoCA for Diagnosing Probable Alzheimer Disease.,OUT_OF_SCOPE,non-Canadian,2,N,Agreement
33171274,New methodological approaches were able to effectively reduce immeasurable time bias in case-only designs.,OUT_OF_SCOPE,non-Canadian,2,N,Agreement
34870125,"Effectiveness of mirror therapy on upper limb function, activities of daily living, and depression in post-stroke depression patients.",OUT_OF_SCOPE,non-Canadian,2,N,Agreement
24571169,Probiotics reduce psychological stress in patients before laryngeal cancer surgery.,OUT_OF_SCOPE,non-Canadian,2,N,Agreement
26674366,"EEG Abnormalities Are Associated With Poorer Depressive Symptom Outcomes With Escitalopram and Venlafaxine-XR, but Not Sertraline: Results From the Multicenter Randomized iSPOT-D Study.",OUT_OF_SCOPE,secondary analysis,2,N,Agreement
26974173,The RECOVER Program: Disability Risk Groups and 1-Year Outcome after 7 or More Days of Mechanical Ventilation.,OUT_OF_SCOPE,non-MH,2,N,Agreement
