id,title,final_decision,category,vote_count,conflict_flag,reconciliation_notes
37694538,"A ""Patient Preference"" Model of Recruitment for Research from Primary-Care-Based Memory Clinics: A Promising New Approach",OUT_OF_SCOPE,excluded_not_rct,OUT_OF_SCOPE:2,none,both screeners agree
row_6585,"Effects of Mental Imagery on Quality of Life, Cognitive, and Emotional Status in Older Adults with Early-Stage Alzheimer’s Disease Dementia: A Randomized Controlled Trial †",OUT_OF_SCOPE,excluded_non_pharmacological,OUT_OF_SCOPE:2,none,both screeners agree
38282390,Premorbid personality traits as predictors for incident predementia syndromes: A multistate model approach,OUT_OF_SCOPE,excluded_not_rct,OUT_OF_SCOPE:2,none,both screeners agree
row_6587,"Omega-3 in the Subjective Betterment of Mood and Sleep Disturbances Induced by Hormone Therapy in Women with Breast Cancer: A Pilot, Randomized, Double-Blinded, Placebo-Controlled Clinical Trial",OUT_OF_SCOPE,excluded_not_mental_disorder,OUT_OF_SCOPE:2,none,both screeners agree
row_6588,Online Externalizing Metaphor Therapy for Mild-to-Moderate Anxiety: A Pilot Study with Young Adults,OUT_OF_SCOPE,excluded_non_pharmacological,OUT_OF_SCOPE:2,none,both screeners agree
38940082,Frequency-Specific Alterations of Fractional Amplitude of Low-Frequency Fluctuations in Adult-Onset Hypothyroidism,OUT_OF_SCOPE,excluded_not_mental_disorder,OUT_OF_SCOPE:2,none,both screeners agree
38579661,Methods for Neuroscience Drug Development: Guidance on Standardization of the Process for Defining Clinical Outcome Strategies in Clinical Trials,OUT_OF_SCOPE,excluded_not_rct,OUT_OF_SCOPE:2,none,both screeners agree
row_6591,Consequences of jury duty on mental health: The current situation and recommendations,OUT_OF_SCOPE,excluded_not_rct,OUT_OF_SCOPE:2,none,both screeners agree
38598465,"Pharmacogenomics-assisted schizophrenia management: A hybrid type 2 effectivenessimplementation study protocol to compare the clinical utility, cost-effectiveness, and barriers",OUT_OF_SCOPE,excluded_protocol,OUT_OF_SCOPE:2,none,both screeners agree
row_6593,BrainFit: improving executive and subjective cognitive functioning in late-life mood disorders - a double-blind randomized active-controlled study evaluating the effect of online cognitive training,OUT_OF_SCOPE,excluded_non_pharmacological,OUT_OF_SCOPE:2,none,both screeners agree
row_6594,Building Self-Efficacy in Dementia Care Through Immersive Education: A Mixed-Methods Randomized Control Trial,OUT_OF_SCOPE,excluded_non_pharmacological,OUT_OF_SCOPE:2,none,both screeners agree
row_6595,Tracking the Trajectory and Predictors of Peritraumatic Distress among Chinese Migrants in Canada across the Three Years of the COVID-19 Pandemic,OUT_OF_SCOPE,excluded_not_rct,OUT_OF_SCOPE:2,none,both screeners agree
row_6596,Low rate of population establishment of a freshwater invertebrate (Gammarus lacustris) in experimental conservation translocations,OUT_OF_SCOPE,excluded_not_mental_disorder,OUT_OF_SCOPE:2,none,both screeners agree
row_6597,"Integrating Branching Spherical Video Learning into Mental Health Nursing Clinical Education: Feasibility, Efficacy, and Student Impact",OUT_OF_SCOPE,excluded_non_pharmacological,OUT_OF_SCOPE:2,none,both screeners agree
38946154,"APOE epsilon variants and composite risk of dementia, disability, and death in the health and retirement study",OUT_OF_SCOPE,excluded_not_rct,OUT_OF_SCOPE:2,none,both screeners agree
row_6599,Neuropsychological outcome of indoor rehabilitation in post-COVID-19 condition—results of the PoCoRe study,OUT_OF_SCOPE,excluded_not_rct,OUT_OF_SCOPE:2,none,both screeners agree
row_6600,Randomized trial on the effects of an EMDR intervention on traumatic and obsessive symptoms during the COVID-19 quarantine: a psychometric study,OUT_OF_SCOPE,excluded_non_pharmacological,OUT_OF_SCOPE:2,none,both screeners agree
38607433,"Healthy blood, healthy brain: a window into understanding and treating neurodegenerative diseases",OUT_OF_SCOPE,excluded_not_rct,OUT_OF_SCOPE:2,none,both screeners agree
row_6602,Sleep quality in cynomolgus macaques (Macaca fascicularis) varies by housing type and following surgery,OUT_OF_SCOPE,excluded_animal_study,OUT_OF_SCOPE:2,none,both screeners agree
39243483,Assessing the efficacy and safety of combined buspirone and venlafaxine treatment in late-life depression accompanied by cognitive impairment: A randomized controlled trial,OUT_OF_SCOPE,excluded_no_canada,OUT_OF_SCOPE:2,none,both screeners agree
39002529,"Remission in schizophrenia spectrum disorders: A randomized trial of amisulpride, aripiprazole and olanzapine",OUT_OF_SCOPE,excluded_no_canada,OUT_OF_SCOPE:2,none,both screeners agree
38271383,Study protocol for RUFUS—A randomized mixed methods pilot clinical trial investigating the relevance and feasibility of rumination-focused cognitive behavioral therapy in the treatment of patients with emergent psychosis spectrum disorders,OUT_OF_SCOPE,excluded_protocol,OUT_OF_SCOPE:2,none,both screeners agree
row_6606,A randomized controlled trial comparing two guided self-help Acceptance and Commitment Therapy formats to education on pain,OUT_OF_SCOPE,excluded_non_pharmacological,OUT_OF_SCOPE:2,none,both screeners agree
38563661,"Activation of mGlu2/3receptors with the orthosteric agonist LY-404,039 alleviates dyskinesia in experimental parkinsonism",OUT_OF_SCOPE,excluded_animal_study,OUT_OF_SCOPE:2,none,both screeners agree
row_6608,"Multi-family therapy for adult outpatients with obsessive-compulsive disorder and their family members, targeting family accommodation",OUT_OF_SCOPE,excluded_non_pharmacological,OUT_OF_SCOPE:2,none,both screeners agree
