id,title,decision,category,notes
26799308,Biased attention retraining in dysphoria: a failure to replicate.,OUT_OF_SCOPE,non_canadian,No Canadian site/PI identified
row_3880,Development and evaluation of a hand tracker using depth images captured from an overhead perspective,OUT_OF_SCOPE,non_canadian,No Canadian site/PI identified
27055612,Screening Medications for the Treatment of Cannabis Use Disorder,OUT_OF_SCOPE,non_canadian,No Canadian site/PI identified
27990198,Ontario health technology assessment series; Magnetic resonance imaging as an adjunct to mammography for breast cancer screening in women at less than high risk for breast cancer: A health technology assessment,OUT_OF_SCOPE,non_mh,No diagnosed MH condition
27245981,Long-term health-related quality of life improvements among patients treated with lurasidone: Results from the open-label extension of a switch trial in schizophrenia,OUT_OF_SCOPE,non_canadian,No Canadian site/PI identified
27450743,Reducing smoking reduces suicidality among individuals with psychosis: Complementary outcomes from a Healthy Lifestyles intervention study,OUT_OF_SCOPE,non_canadian,No Canadian site/PI identified
28072459,Client Retrospective Accounts of Corrective Experiences in Motivational Interviewing Integrated With Cognitive Behavioral Therapy for Generalized Anxiety Disorder,OUT_OF_SCOPE,non_canadian,No Canadian site/PI identified
row_3886,"Recasting Psychodynamics into a Behavioral Framework: A Review of the Theory of Psychopathology, Treatment Efficacy, and Process of Change of the Affect Phobia Model",OUT_OF_SCOPE,non_canadian,No Canadian site/PI identified
row_3887,Effects of mechanical processing and annealing on optical coherence properties of Er3+:LiNbO3 powders,OUT_OF_SCOPE,non_rct,Not an RCT
28474733,Practitioner Review: The effects of atypical antipsychotics and mood stabilisers in the treatment of depressive symptoms in paediatric bipolar disorder,OUT_OF_SCOPE,non_canadian,No Canadian site/PI identified
28914085,Development of a patient-centered conceptual model of the impact of living with autism spectrum disorder,OUT_OF_SCOPE,non_canadian,No Canadian site/PI identified
29402536,"A demographic, clinical, and behavioral typology of obesity in the United States: an analysis of National Health and Nutrition Examination Survey 2011–2012",OUT_OF_SCOPE,non_canadian,No Canadian site/PI identified
29537978,A Randomized Trial of Oral and Transdermal Rivastigmine for Postural Instability in Parkinson Disease Dementia,OUT_OF_SCOPE,non_canadian,No Canadian site/PI identified
29609146,Effects of a psychotherapeutic group intervention in patients with refractory mesial temporal lobe epilepsy and comorbid psychogenic nonepileptic seizures: A nonrandomized controlled study,OUT_OF_SCOPE,non_pharma,Non-pharmacological intervention
29336871,Epigenetic regulation of the kappa opioid receptor gene by an insertion–deletion in the promoter region,OUT_OF_SCOPE,non_canadian,No Canadian site/PI identified
row_3894,Effectiveness Trial of Brief Indicated Cognitive-Behavioral Group Depression Prevention in French-Canadian Secondary Schools,OUT_OF_SCOPE,non_pharma,Non-pharmacological intervention
31124418,Impact of Cognition and Handfeeding Assistance on Nutritional Intake for Nursing Home Residents,OUT_OF_SCOPE,non_canadian,No Canadian site/PI identified
31492662,Amelioration of both central and peripheral neuropathy in mouse models of type 1 and type 2 diabetes by the neurogenic molecule NSI-189,OUT_OF_SCOPE,non_canadian,No Canadian site/PI identified
row_3897,"Designing and Evaluating Calmer, a Device for Simulating Maternal Skin-to-Skin Holding for Premature Infants",OUT_OF_SCOPE,non_canadian,No Canadian site/PI identified
row_3898,Prevalence and predictors of neurocognitive impairment in ethiopian population living with HIV,OUT_OF_SCOPE,non_canadian,No Canadian site/PI identified
31111797,Construct validity of the Visual Cognitive Assessment Test (VCAT) - A cross-cultural language-neutral cognitive screening tool,OUT_OF_SCOPE,non_mh,No diagnosed MH condition
