id,title,decision,category,notes
,The Relationship Between the Gut Microbiome-Immune System-Brain Axis and Major Depressive Disorder,OUT_OF_SCOPE,not_canadian,No Canadian site/PI indicators
30738426,"Ambroxol as a novel disease-modifying treatment for Parkinson's disease dementia: protocol for a single-centre, randomized, double-blind, placebo-controlled trial.",OUT_OF_SCOPE,not_canadian,No Canadian site/PI indicators
29687457,A randomized waitlist-controlled trial of cognitive behavior therapy to improve emotion regulation in children with autism.,OUT_OF_SCOPE,not_pharmacotherapy,No pharma intervention
,Reducing anxiety in the foreign language classroom: A positive psychology approach,OUT_OF_SCOPE,not_pharmacotherapy,No pharma intervention
26571534,Seizure Suppression Efficacy of Closed-Loop Versus Open-Loop Deep Brain Stimulation in a Rodent Model of Epilepsy,OUT_OF_SCOPE,non_interventional,"Study type: rat, rats, Rodent"
