id,title,decision,category,notes
39762105,"Effects of nurse-home visiting on intimate partner violence and maternal income, mental health and self-efficacy by 24 months postpartum: a randomised controlled trial (British Columbia Healthy Connections Project).",OUT_OF_SCOPE,not_mh,No MH diagnosis
39758508,Effect of randomised blood pressure lowering treatment and intensive glucose control on dementia and cognitive decline according to baseline cognitive function and other subpopulations of individuals with type 2 diabetes: Results from the ADVANCE trial.,OUT_OF_SCOPE,not_mh,No MH diagnosis
39755599,Effects of intermittent theta burst stimulation on cognitive and swallowing function in patients with MCI and dysphagia risk: a randomized controlled trial.,OUT_OF_SCOPE,not_mh,No MH diagnosis
39754615,Increased parietal operculum functional connectivity following vestibular rehabilitation in benign paroxysmal positional vertigo patients with residual dizziness: a randomized controlled resting-state fMRI study.,OUT_OF_SCOPE,non_pharma,Non-pharmacological intervention
39736898,Correlates of neurocognitive performance in older adults with chronic pain and negative emotions: baseline data from the problem adaptation therapy for pain (PATH-pain) randomized controlled trial.,OUT_OF_SCOPE,non_mh_primary,Primary condition not MH
39665954,PET in neurotherapeutic discovery and development.,OUT_OF_SCOPE,not_mh,No MH diagnosis
39657760,Effect of recreational sport and physical activity participation on well-being during early parenthood: a randomized controlled trial.,OUT_OF_SCOPE,not_mh,No MH diagnosis
39634772,Brain function assessment of acupuncture for chronic insomnia disorder with mild cognitive dysfunction based on fNIRS: protocol for a randomized controlled trial.,OUT_OF_SCOPE,protocol_no_results,Protocol without results
39631702,Self-criticism predicts antidepressant effects of intermittent theta-burst stimulation in Major Depressive Disorder.,OUT_OF_SCOPE,not_canadian,No Canadian site/PI
