id,title,decision,category,notes
30732716,Atrial Fibrillation and Cognitive Function: JACC Review Topic of the Week.,OUT_OF_SCOPE,not_pharmacotherapy,No pharma intervention
,Can an Infection Hypothesis Explain the Beta Amyloid Hypothesis of Alzheimer’s Disease?,OUT_OF_SCOPE,not_pharmacotherapy,No pharma intervention
31185140,Benefits of curcumin in brain disorders,OUT_OF_SCOPE,not_pharmacotherapy,No pharma intervention
30332919,A meta-analytic review of cognitive processing therapy for adults with posttraumatic stress disorder.,OUT_OF_SCOPE,non_interventional,Study type: meta-analysis
26954409,Effect of Vitamin D supplementation on Tibial cartilage volume and knee pain among patients with symptomatic knee osteoarthritis: A randomized clinical trial,OUT_OF_SCOPE,not_mental_health,No MH condition identified
30352997,Music improves social communication and auditory-motor connectivity in children with autism.,OUT_OF_SCOPE,not_canadian,No Canadian site/PI indicators
34907394,A Delphi-method-based consensus guideline for definition of treatment-resistant depression for clinical trials.,OUT_OF_SCOPE,not_canadian,No Canadian site/PI indicators
30902566,Mild Behavioral Impairment as a Marker of Cognitive Decline in Cognitively Normal Older Adults,OUT_OF_SCOPE,not_pharmacotherapy,No pharma intervention
31786030,"Efficacy and safety of adjunctive therapy using esketamine or racemic ketamine for adult treatment-resistant depression: A randomized, double-blind, non-inferiority study.",OUT_OF_SCOPE,not_canadian,No Canadian site/PI indicators
31584222,Exercise increases caudate dopamine release and ventral striatal activation in Parkinson's disease.,OUT_OF_SCOPE,not_pharmacotherapy,No pharma intervention
28416342,"Long-term safety and tolerability of apremilast in patients with psoriasis: Pooled safety analysis for ≥156 weeks from 2 phase 3, randomized, controlled trials (ESTEEM 1 and 2).",OUT_OF_SCOPE,not_canadian,No Canadian site/PI indicators
34964367,First-in-Human Experience and Acute Procedural Outcomes Using a Novel Pulsed Field Ablation System: The PULSED AF Pilot Trial,OUT_OF_SCOPE,not_pharmacotherapy,No pharma intervention
27537670,"Virtual versus face-to-face clinical simulation in relation to student knowledge, anxiety, and self-confidence in maternal-newborn nursing: A randomized controlled trial.",OUT_OF_SCOPE,not_pharmacotherapy,No pharma intervention
32280099,Clinical and Bacterial Markers of Periodontitis and Their Association with Incident All-Cause and Alzheimer's Disease Dementia in a Large National Survey.,OUT_OF_SCOPE,not_pharmacotherapy,No pharma intervention
27059158,A STUDY OF THE PATTERN OF RESPONSE TO rTMS TREATMENT IN DEPRESSION,OUT_OF_SCOPE,not_pharmacotherapy,No pharma intervention
34212944,A critical overview of computational approaches employed for COVID-19 drug discovery,OUT_OF_SCOPE,not_pharmacotherapy,No pharma intervention
35311615,Clinician guidelines for the treatment of psychiatric disorders with nutraceuticals and phytoceuticals: The World Federation of Societies of Biological Psychiatry (WFSBP) and Canadian Network for Mood and Anxiety Treatments (CANMAT) Taskforce,OUT_OF_SCOPE,not_rct,"Clinical practice guideline, not an RCT"
29946212,Facts and myths pertaining to fibromyalgia.,OUT_OF_SCOPE,non_interventional,"Study type: guideline, prevalence"
29946106,"Efficacy, tolerability, and cognitive effects of deep transcranial magnetic stimulation for late-life depression: a prospective randomized controlled trial.",OUT_OF_SCOPE,not_canadian,No Canadian site/PI indicators
33860614,Measures of resting state EEG rhythms for clinical trials in Alzheimer's disease: Recommendations of an expert panel,OUT_OF_SCOPE,not_pharmacotherapy,No pharma intervention
31285147,"Safety and efficacy of opicinumab in patients with relapsing multiple sclerosis (SYNERGY): a randomised, placebo-controlled, phase 2 trial.",OUT_OF_SCOPE,not_canadian,No Canadian site/PI indicators
37039129,Evidence-based consensus guidelines for the management of catatonia: Recommendations from the British Association for Psychopharmacology.,OUT_OF_SCOPE,not_canadian,No Canadian site/PI indicators
27708129,Multifocal repetitive TMS for motor and mood symptoms of Parkinson disease: A randomized trial.,OUT_OF_SCOPE,not_pharmacotherapy,No pharma intervention
28985956,Psychiatric adverse events during treatment with brodalumab: Analysis of psoriasis clinical trials.,OUT_OF_SCOPE,not_canadian,No Canadian site/PI indicators
29679069,Pharmacological treatment of adult bipolar disorder.,OUT_OF_SCOPE,not_canadian,No Canadian site/PI indicators
29661195,Impact of patient involvement on clinical practice guideline development: a parallel group study.,OUT_OF_SCOPE,not_pharmacotherapy,No pharma intervention
33279966,"Depression, dementia and immune dysregulation",OUT_OF_SCOPE,not_canadian,No Canadian site/PI indicators
29117922,"Depression, anxiety, and post-traumatic stress disorder among youth in low and middle income countries: A review of prevalence and treatment interventions.",OUT_OF_SCOPE,not_pharmacotherapy,No pharma intervention
29741208,Induction of labour for improving birth outcomes for women at or beyond term.,OUT_OF_SCOPE,not_pharmacotherapy,No pharma intervention
30845817,Cariprazine Treatment of Bipolar Depression: A Randomized Double-Blind Placebo-Controlled Phase 3 Study,OUT_OF_SCOPE,not_canadian,No Canadian site/PI indicators
32040141,Comparison of Integrated Outpatient Palliative Care With Standard Care in Patients With Parkinson Disease and Related Disorders: A Randomized Clinical Trial.,OUT_OF_SCOPE,not_pharmacotherapy,No pharma intervention
31806127,Risk Factors for Infections Involving Cardiac Implanted Electronic Devices.,OUT_OF_SCOPE,not_rct,No RCT indicators found
29143192,Middle East Respiratory Syndrome and Severe Acute Respiratory Syndrome: Current Therapeutic Options and Potential Targets for Novel Therapies.,OUT_OF_SCOPE,not_canadian,No Canadian site/PI indicators
,Speech analysis by natural language processing techniques: A possible tool for very early detection of cognitive decline?,OUT_OF_SCOPE,not_pharmacotherapy,No pharma intervention
35431912,Therapeutic Alliance and Rapport Modulate Responses to Psilocybin Assisted Therapy for Depression.,OUT_OF_SCOPE,not_canadian,No Canadian site/PI indicators
30694576,A randomized study of solriamfetol for excessive sleepiness in narcolepsy.,OUT_OF_SCOPE,not_canadian,No Canadian site/PI indicators
29049348,Chronic administration of fluoxetine and pro-inflammatory cytokine change in a rat model of depression.,OUT_OF_SCOPE,not_canadian,No Canadian site/PI indicators
30791895,Clinical and metabolic response to vitamin D plus probiotic in schizophrenia patients.,OUT_OF_SCOPE,not_canadian,No Canadian site/PI indicators
28629879,Prediction of cognition in Parkinson's disease with a clinical-genetic score: a longitudinal analysis of nine cohorts.,OUT_OF_SCOPE,non_interventional,Study type: genetic
28661865,Health benefits of tai chi: What is the evidence?,OUT_OF_SCOPE,not_pharmacotherapy,No pharma intervention
31483964,Safety and efficacy of mitapivat in pyruvate kinase deficiency,OUT_OF_SCOPE,not_mental_health,No MH condition identified
35150086,"Effects of Vivifrail multicomponent intervention on functional capacity: a multicentre, randomized controlled trial.",OUT_OF_SCOPE,not_pharmacotherapy,No pharma intervention
,Late-onset vs nonmendelian early-onset Alzheimer disease: A distinction without a difference?,OUT_OF_SCOPE,not_mental_health,No MH condition identified
32445690,"Minocycline and celecoxib as adjunctive treatments for bipolar depression: a multicentre, factorial design randomised controlled trial.",UNCERTAIN,possible_canadian_pi,RCT; bipolar depression (DSM-5); minocycline/celecoxib (pharma); study conducted in Pakistan; PI Husain MI may have Canadian affiliation
29486956,Virtual reality therapy for refractory auditory verbal hallucinations in schizophrenia: A pilot clinical trial.,OUT_OF_SCOPE,not_canadian,No Canadian site/PI indicators
27182765,"Cultivating teacher mindfulness: Effects of a randomized controlled trial on work, home, and sleep outcomes.",OUT_OF_SCOPE,not_mental_health,No MH condition identified
28381506,A phase 3 trial of IV immunoglobulin for Alzheimer disease,OUT_OF_SCOPE,not_canadian,No Canadian site/PI indicators
37582238,Integrative Oncology Care of Symptoms of Anxiety and Depression in Adults With Cancer: Society for Integrative Oncology-ASCO Guideline.,OUT_OF_SCOPE,not_pharmacotherapy,No pharma intervention
36094645,Association of Amyloid Reduction After Donanemab Treatment With Tau Pathology and Clinical Outcomes: The TRAILBLAZER-ALZ Randomized Clinical Trial.,OUT_OF_SCOPE,not_mental_health,No MH condition identified
28221821,Enhanced neural activation with blueberry supplementation in mild cognitive impairment.,OUT_OF_SCOPE,not_canadian,No Canadian site/PI indicators
26976529,Interventions for improving outcomes in patients with multimorbidity in primary care and community settings,OUT_OF_SCOPE,not_canadian,No Canadian site/PI indicators
38890531,Plasma extracellular vesicle tau and TDP-43 as diagnostic biomarkers in FTD and ALS,OUT_OF_SCOPE,not_pharmacotherapy,No pharma intervention
31914223,Mild behavioral impairment is associated with β-amyloid but not tau or neurodegeneration in cognitively intact elderly individuals.,OUT_OF_SCOPE,not_pharmacotherapy,No pharma intervention
35997729,Effect of Radiotherapy Alone vs Radiotherapy With Concurrent Chemoradiotherapy on Survival Without Disease Relapse in Patients With Low-risk Nasopharyngeal Carcinoma: A Randomized Clinical Trial.,OUT_OF_SCOPE,not_pharmacotherapy,No pharma intervention
30237454,Therapeutic approaches to huntington disease: From the bench to the clinic,OUT_OF_SCOPE,not_mental_health,No MH condition identified
31081899,Acupuncture Versus Cognitive Behavioral Therapy for Insomnia in Cancer Survivors: A Randomized Clinical Trial,OUT_OF_SCOPE,not_mental_health,No MH condition identified
,Ketamine as an antidepressant: overview of its mechanisms of action and potential predictive biomarkers,OUT_OF_SCOPE,not_canadian,No Canadian site/PI indicators
34587384,Maintenance or Discontinuation of Antidepressants in Primary Care.,OUT_OF_SCOPE,not_canadian,No Canadian site/PI indicators
31182351,Randomized Placebo-Controlled Trial of Nabilone for Agitation in Alzheimer's Disease.,OUT_OF_SCOPE,not_canadian,No Canadian site/PI indicators
30764649,Trajectories of Response to Dorsolateral Prefrontal rTMS in Major Depression: A THREE-D Study.,OUT_OF_SCOPE,not_canadian,No Canadian site/PI indicators
27213646,Telephone-Based Cognitive Behavioral Therapy for Insomnia in Perimenopausal and Postmenopausal Women With Vasomotor Symptoms: A MsFLASH Randomized Clinical Trial.,OUT_OF_SCOPE,not_mental_health,No MH condition identified
,Application of machine learning methods for the prediction of crystal system of cathode materials in lithium-ion batteries,OUT_OF_SCOPE,not_mental_health,No MH condition identified
35110300,"Ketamine for the acute treatment of severe suicidal ideation: double blind, randomised placebo controlled trial.",OUT_OF_SCOPE,not_canadian,No Canadian site/PI indicators
27721184,"Liraglutide promotes improvements in objective measures of cognitive dysfunction in individuals with mood disorders: A pilot, open-label study.",OUT_OF_SCOPE,not_canadian,No Canadian site/PI indicators
33103819,A ketogenic drink improves cognition in mild cognitive impairment: Results of a 6-month RCT.,OUT_OF_SCOPE,not_canadian,No Canadian site/PI indicators
29067316,Active Aβ immunotherapy CAD106 in Alzheimer's disease: A phase 2b study.,OUT_OF_SCOPE,not_canadian,No Canadian site/PI indicators
28709498,Targeting Fyn Kinase in Alzheimer's Disease.,OUT_OF_SCOPE,not_mental_health,No MH condition identified
30075165,Ketogenic diet as a metabolic therapy for mood disorders: Evidence and developments,OUT_OF_SCOPE,not_canadian,No Canadian site/PI indicators
33949763,Diagnostic criteria for apathy in neurocognitive disorders,OUT_OF_SCOPE,not_pharmacotherapy,No pharma intervention
28867259,Early and Late CNS Inflammation in Alzheimer's Disease: Two Extremes of a Continuum?,OUT_OF_SCOPE,not_pharmacotherapy,No pharma intervention
34878526,Stratified Care vs Stepped Care for Depression: A Cluster Randomized Clinical Trial.,OUT_OF_SCOPE,not_pharmacotherapy,No pharma intervention
27858962,A randomized trial of brief dialectical behaviour therapy skills training in suicidal patients suffering from borderline disorder.,OUT_OF_SCOPE,not_pharmacotherapy,No pharma intervention
29366418,"Ayahuasca: Psychological and physiologic effects, pharmacology and potential uses in addiction and mental illness",OUT_OF_SCOPE,not_pharmacotherapy,No pharma intervention
30388439,The effect of spermidine on memory performance in older adults at risk for dementia: A randomized controlled trial.,OUT_OF_SCOPE,not_canadian,No Canadian site/PI indicators
29298868,Auditory-somatosensory bimodal stimulation desynchronizes brain circuitry to reduce tinnitus in guinea pigs and humans.,OUT_OF_SCOPE,not_pharmacotherapy,No pharma intervention
33554909,Mild Behavioral Impairment and Subjective Cognitive Decline Predict Cognitive and Functional Decline.,OUT_OF_SCOPE,not_pharmacotherapy,No pharma intervention
36133318,Fatigue and cognitive impairment after COVID-19: A prospective multicentre study.,OUT_OF_SCOPE,not_pharmacotherapy,No pharma intervention
29101095,Smartphone Cognitive Behavioral Therapy as an Adjunct to Pharmacotherapy for Refractory Depression: Randomized Controlled Trial.,OUT_OF_SCOPE,not_canadian,No Canadian site/PI indicators
27193737,Randomized-controlled trial of mindfulness-based cancer recovery versus supportive expressive group therapy among distressed breast cancer survivors (MINDSET): long-term follow-up results.,OUT_OF_SCOPE,not_pharmacotherapy,No pharma intervention
26985729,Integrating motivational interviewing with cognitive-behavioral therapy for severe generalized anxiety disorder: An allegiance-controlled randomized clinical trial,OUT_OF_SCOPE,not_canadian,No Canadian site/PI indicators
28649313,The EU-AIMS Longitudinal European Autism Project (LEAP): Clinical characterisation,OUT_OF_SCOPE,not_pharmacotherapy,No pharma intervention
30058285,A review of clinical treatment considerations of donepezil in severe Alzheimer's disease.,OUT_OF_SCOPE,not_mental_health,No MH condition identified
29474009,Direct and Indirect Cost Burden and Change of Employment Status in Treatment-Resistant Depression: A Matched-Cohort Study Using a US Commercial Claims Database.,OUT_OF_SCOPE,non_interventional,Study type: Cohort Study
27909645,Personality-Targeted Interventions for Substance Use and Misuse.,OUT_OF_SCOPE,not_canadian,No Canadian site/PI indicators
38519618,Drug-resistant tuberculosis: a persistent global health concern.,OUT_OF_SCOPE,not_pharmacotherapy,No pharma intervention
34942085,"Efficacy and safety of elexacaftor plus tezacaftor plus ivacaftor versus tezacaftor plus ivacaftor in people with cystic fibrosis homozygous for F508del-CFTR: a 24-week, multicentre, randomised, double-blind, active-controlled, phase 3b trial.",OUT_OF_SCOPE,not_canadian,No Canadian site/PI indicators
31329216,Effect of AZD0530 on Cerebral Metabolic Decline in Alzheimer Disease: A Randomized Clinical Trial.,OUT_OF_SCOPE,not_canadian,No Canadian site/PI indicators
29481976,Randomized Controlled Trial of Online Acceptance and Commitment Therapy for Fibromyalgia.,OUT_OF_SCOPE,not_pharmacotherapy,No pharma intervention
27516079,Lithium Poisoning.,OUT_OF_SCOPE,not_canadian,No Canadian site/PI indicators
30297272,No. 367-2019 Canadian Guideline for Physical Activity throughout Pregnancy.,OUT_OF_SCOPE,not_pharmacotherapy,No pharma intervention
27823981,Repetitive transcranial magnetic stimulation improves cognitive function of Alzheimer's disease patients.,OUT_OF_SCOPE,not_mental_health,No MH condition identified
29457674,A review of brain stimulation methods to treat substance use disorders,OUT_OF_SCOPE,not_canadian,No Canadian site/PI indicators
29551618,"Long-term effects of discontinuation from antipsychotic maintenance following first-episode schizophrenia and related disorders: a 10 year follow-up of a randomised, double-blind trial.",OUT_OF_SCOPE,not_canadian,No Canadian site/PI indicators
31914218,Utility of the global CDR® plus NACC FTLD rating and development of scoring rules: Data from the ARTFL/LEFFTDS Consortium,OUT_OF_SCOPE,not_pharmacotherapy,No pharma intervention
26913614,Internet-Assisted Parent Training Intervention for Disruptive Behavior in 4-Year-Old Children: A Randomized Clinical Trial.,OUT_OF_SCOPE,not_canadian,No Canadian site/PI indicators
29565038,GABAergic inhibitory neurons as therapeutic targets for cognitive impairment in schizophrenia,OUT_OF_SCOPE,not_pharmacotherapy,No pharma intervention
30686385,Delivering the Thinking Healthy Programme for perinatal depression through peers: an individually randomised controlled trial in India.,OUT_OF_SCOPE,not_pharmacotherapy,No pharma intervention
29630702,"Cardiovascular Safety of Varenicline, Bupropion, and Nicotine Patch in Smokers: A Randomized Clinical Trial.",OUT_OF_SCOPE,not_canadian,No Canadian site/PI indicators
32101271,Effects of Antipsychotic Medication on Brain Structure in Patients With Major Depressive Disorder and Psychotic Features: Neuroimaging Findings in the Context of a Randomized Placebo-Controlled Clinical Trial.,OUT_OF_SCOPE,not_canadian,No Canadian site/PI indicators
32347544,"HIITing the brain with exercise: mechanisms, consequences and practical recommendations.",OUT_OF_SCOPE,not_pharmacotherapy,No pharma intervention
27760869,Aerobic exercise and vascular cognitive impairment,OUT_OF_SCOPE,not_mental_health,No MH condition identified
,Hypertension and the Risk of Dementia,OUT_OF_SCOPE,not_pharmacotherapy,No pharma intervention
37859748,Clinical safety and efficacy of allogenic human adipose mesenchymal stromal cells-derived exosomes in patients with mild to moderate Alzheimer's disease: a phase I/II clinical trial.,OUT_OF_SCOPE,not_mental_health,No MH condition identified
31601406,Effects of cannabidiol (CBD) in neuropsychiatric disorders: A review of pre-clinical and clinical findings.,OUT_OF_SCOPE,not_canadian,No Canadian site/PI indicators
29282470,Efficacy and Safety of Transcranial Direct Current Stimulation as an Add-on Treatment for Bipolar Depression: A Randomized Clinical Trial.,OUT_OF_SCOPE,not_pharmacotherapy,No pharma intervention
31995132,Outcomes of Online Mindfulness-Based Cognitive Therapy for Patients With Residual Depressive Symptoms: A Randomized Clinical Trial.,OUT_OF_SCOPE,not_pharmacotherapy,No pharma intervention
31282772,Esketamine for treatment resistant depression.,OUT_OF_SCOPE,not_canadian,No Canadian site/PI indicators
36202135,Clinical guidelines for the use of lifestyle-based mental health care in major depressive disorder: World Federation of Societies for Biological Psychiatry (WFSBP) and Australasian Society of Lifestyle Medicine (ASLM) taskforce,OUT_OF_SCOPE,not_canadian,No Canadian site/PI indicators
33587135,Effects of Tai Chi or Exercise on Sleep in Older Adults With Insomnia: A Randomized Clinical Trial.,OUT_OF_SCOPE,not_mental_health,No MH condition identified
28294985,"Effects of a Diet-Based Weight-Reducing Program with Probiotic Supplementation on Satiety Efficiency, Eating Behaviour Traits, and Psychosocial Behaviours in Obese Individuals.",OUT_OF_SCOPE,not_canadian,No Canadian site/PI indicators
,"Digital technologies as biomarkers, clinical outcomes assessment, and recruitment tools in Alzheimer's disease clinical trials",OUT_OF_SCOPE,not_pharmacotherapy,No pharma intervention
32682954,Passive immunotherapies targeting Aβ and tau in Alzheimer's disease,OUT_OF_SCOPE,not_mental_health,No MH condition identified
29178317,Community Program Improves Quality of Life and Self-Management in Older Adults with Diabetes Mellitus and Comorbidity.,OUT_OF_SCOPE,not_pharmacotherapy,No pharma intervention
30025745,Trimodal prehabilitation for colorectal surgery attenuates post-surgical losses in lean body mass: A pooled analysis of randomized controlled trials.,OUT_OF_SCOPE,not_pharmacotherapy,No pharma intervention
31487175,"Discovery of MK-8719, a Potent O-GlcNAcase Inhibitor as a Potential Treatment for Tauopathies",OUT_OF_SCOPE,not_mental_health,No MH condition identified
27099154,Dexmedetomidine vs propofol-remifentanil conscious sedation for awake craniotomy: a prospective randomized controlled trial.,OUT_OF_SCOPE,not_pharmacotherapy,No pharma intervention
29378790,Features of GBA-associated Parkinson's disease at presentation in the UK Tracking Parkinson's study.,OUT_OF_SCOPE,not_pharmacotherapy,No pharma intervention
32134208,"Efficacy of multidomain interventions to improve physical frailty, depression and cognition: data from cluster-randomized controlled trials.",OUT_OF_SCOPE,not_pharmacotherapy,No pharma intervention
,Breaking the vicious cycle of language anxiety: Growth language mindsets improve lower-competence ESL students’ intercultural interactions,OUT_OF_SCOPE,not_pharmacotherapy,No pharma intervention
38754041,Management of Fatigue in Adult Survivors of Cancer: ASCO-Society for Integrative Oncology Guideline Update.,OUT_OF_SCOPE,not_mental_health,No MH condition identified
36740140,"Single-dose psilocybin for a treatment-resistant episode of major depression: Impact on patient-reported depression severity, anxiety, function, and quality of life.",OUT_OF_SCOPE,not_canadian,No Canadian site/PI indicators
,Multiple comorbid neuropathologies in the setting of Alzheimer's disease neuropathology and implications for drug development,OUT_OF_SCOPE,not_pharmacotherapy,No pharma intervention
27960229,Automated telephone communication systems for preventive healthcare and management of long-term conditions.,OUT_OF_SCOPE,not_canadian,No Canadian site/PI indicators
28863302,Beyond the Normalized Difference Vegetation Index (NDVI): Developing a Natural Space Index for population-level health research.,OUT_OF_SCOPE,non_interventional,Study type: epidemiolog
29703724,Outcomes at 18 Months From a Community Health Worker and Peer Leader Diabetes Self-Management Program for Latino Adults.,OUT_OF_SCOPE,not_pharmacotherapy,No pharma intervention
,Review of Diagnosis-Related Group-Based Financing of Hospital Care,OUT_OF_SCOPE,not_pharmacotherapy,No pharma intervention
27842939,"Efficacy and safety of high-dose baclofen for the treatment of alcohol dependence: A multicentre, randomised, double-blind controlled trial",OUT_OF_SCOPE,not_canadian,No Canadian site/PI indicators
34476868,European Stroke Organisation and European Academy of Neurology joint guidelines on post-stroke cognitive impairment,OUT_OF_SCOPE,not_pharmacotherapy,No pharma intervention
30616546,Validation of a case definition for depression in administrative data against primary chart data as a reference standard.,OUT_OF_SCOPE,non_interventional,"Study type: chart review, prevalence"
32355269,Vulvodynia.,OUT_OF_SCOPE,not_pharmacotherapy,No pharma intervention
30933317,Yoga for symptom management in oncology: A review of the evidence base and future directions for research.,OUT_OF_SCOPE,not_pharmacotherapy,No pharma intervention
27207917,Absolute Measurements of Macrophage Migration Inhibitory Factor and Interleukin-1-β mRNA Levels Accurately Predict Treatment Response in Depressed Patients.,OUT_OF_SCOPE,not_mental_health,No MH condition identified
26834024,"Cost-Effectiveness of Comprehensive, Integrated Care for First Episode Psychosis in the NIMH RAISE Early Treatment Program.",OUT_OF_SCOPE,not_canadian,No Canadian site/PI indicators
30099030,Neural correlates of liraglutide effects in persons at risk for Alzheimer's disease.,OUT_OF_SCOPE,not_mental_health,No MH condition identified
,Identity and Epistemic Emotions During Knowledge Revision: A Potential Account for the Backfire Effect,OUT_OF_SCOPE,not_pharmacotherapy,No pharma intervention
28734089,Dementia risk and prevention by targeting modifiable vascular risk factors,OUT_OF_SCOPE,not_canadian,No Canadian site/PI indicators
31164006,Evidence for network-based cortical thickness reductions in schizophrenia,OUT_OF_SCOPE,non_interventional,Study type: cross-sectional
29939045,With a little help from my boss: The impact of workplace mental health training on leader behaviors and employee resource utilization,OUT_OF_SCOPE,not_pharmacotherapy,No pharma intervention
31735048,Patient and caregiver characteristics associated with caregiver burden in Parkinson's disease: a palliative care approach.,OUT_OF_SCOPE,not_pharmacotherapy,No pharma intervention
29377952,Immune-related genetic enrichment in frontotemporal dementia: An analysis of genome-wide association studies,OUT_OF_SCOPE,not_canadian,No Canadian site/PI indicators
30237705,Effects of a specially designed aerobic dance routine on mild cognitive impairment.,OUT_OF_SCOPE,not_pharmacotherapy,No pharma intervention
26844979,Amphetamines for attention deficit hyperactivity disorder (ADHD) in children and adolescents.,OUT_OF_SCOPE,not_canadian,No Canadian site/PI indicators
29937184,Prehabilitation for radical prostatectomy: A multicentre randomized controlled trial.,OUT_OF_SCOPE,not_pharmacotherapy,No pharma intervention
27712106,A Pilot Study of Eight-Session Mindfulness-Based Cognitive Therapy Adapted for Women’s Sexual Interest/Arousal Disorder,OUT_OF_SCOPE,not_pharmacotherapy,No pharma intervention
36129719,Effectiveness of Standard Sequential Bilateral Repetitive Transcranial Magnetic Stimulation vs Bilateral Theta Burst Stimulation in Older Adults With Depression: The FOUR-D Randomized Noninferiority Clinical Trial.,OUT_OF_SCOPE,not_pharmacotherapy,"rTMS/TBS is neuromodulation, not pharmacotherapy"
