id,title,final_decision,category,vote_count,conflict_flag,reconciliation_notes
29693533,Development and evaluation of a scale assessing therapist fidelity to guidelines for delivering therapist-assisted Internet-delivered cognitive behaviour therapy.,OUT_OF_SCOPE,Non-pharmacological,3/3,N,Unanimous agreement
31303261,Strengthened Hippocampal Circuits Underlie Enhanced Retrieval of Extinguished Fear Memories Following Mindfulness Training.,OUT_OF_SCOPE,Non-pharmacological,3/3,N,Unanimous agreement
10.5935/0103-5053.20160048,Current approaches against Alzheimer's disease in clinical trials,OUT_OF_SCOPE,Review,3/3,N,Unanimous agreement
10.1016/j.trci.2016.02.004,Dissociation of Down syndrome and Alzheimer's disease effects with imaging,OUT_OF_SCOPE,Non-RCT,3/3,N,Unanimous agreement
30514614,Inferior thalamic peduncle deep brain stimulation for treatment-refractory obsessive-compulsive disorder: A phase 1 pilot trial,OUT_OF_SCOPE,Non-pharmacological,3/3,N,Unanimous agreement
31901940,Morphological Profiling of Schizophrenia: Cluster Analysis of MRI-Based Cortical Thickness Data,OUT_OF_SCOPE,Non-RCT,3/3,N,Unanimous agreement
31647267,The Independent Roles of Mindfulness and Distress Tolerance in Treatment Outcomes in Dialectical Behavior Therapy Skills Training,OUT_OF_SCOPE,Non-pharmacological,3/3,N,Unanimous agreement
32840330,Current and Evolving Treatment Strategies for the Alzheimer Disease Continuum,OUT_OF_SCOPE,Review,3/3,N,Unanimous agreement
33870914,A Core Outcome Set for Research Evaluating Interventions to Prevent and/or Treat Delirium in Critically Ill Adults,OUT_OF_SCOPE,Non-RCT,3/3,N,Unanimous agreement
10.1037/ppm0000460,Reducing Social Media Use Improves Appearance and Weight Esteem in Youth With Emotional Distress,OUT_OF_SCOPE,Non-pharmacological,3/3,N,Unanimous agreement
38471397,Comparison of two plasma p-tau217 assays to detect and monitor Alzheimer's pathology.,OUT_OF_SCOPE,Non-RCT,3/3,N,Unanimous agreement
32106225,Trajectories and mental health-related predictors of perceived discrimination and stigma among homeless adults with mental illness.,OUT_OF_SCOPE,Non-RCT,3/3,N,Unanimous agreement
35286849,The effects of MDMA-assisted therapy on alcohol and substance use in a phase 3 trial for treatment of severe PTSD.,UNCERTAIN,Pharmacological RCT,2/3,N,Majority rule (2/3); dissent: OUT_OF_SCOPE
36409969,Phase IIb Randomized Placebo-Controlled Dose-Escalating Double-Blind Study of Cannabidiol Oil for the Relief of Symptoms in Advanced Cancer (MedCan1-CBD).,OUT_OF_SCOPE,Non-mental-health,3/3,N,Unanimous agreement
27284082,Methylene blue treatment for residual symptoms of bipolar disorder: randomised crossover study.,MAP,Mental health pharma RCT,3/3,N,Unanimous agreement
34228123,Efficacy of a stepped care approach to deliver cognitive-behavioral therapy for insomnia in cancer patients.,OUT_OF_SCOPE,Non-pharmacological,3/3,N,Unanimous agreement
32084347,Therapeutic Effects of Exercise Training on Elderly Patients With Dementia: A Randomized Controlled Trial.,OUT_OF_SCOPE,Non-pharmacological,3/3,N,Unanimous agreement
33264098,Correction: A Mindfulness-Based Intervention for Student Depression Anxiety and Stress: Randomized Controlled Trial.,OUT_OF_SCOPE,Non-pharmacological,3/3,N,Unanimous agreement
31045590,Curcumin as Add-On to Antipsychotic Treatment in Patients With Chronic Schizophrenia: A Randomized Double-Blind Placebo-Controlled Study.,UNCERTAIN,Pharmacological RCT,2/3,N,Majority rule (2/3); dissent: MAP
28266318,A randomised controlled trial of Intensive Short-Term Dynamic Psychotherapy for treatment resistant depression: the Halifax Depression Study.,OUT_OF_SCOPE,Non-pharmacological,3/3,N,Unanimous agreement
28262134,Interventions in ADHD: A comparative review of stimulant medications and behavioral therapies.,OUT_OF_SCOPE,Review,3/3,N,Unanimous agreement
32970955,Osteochondroplasty and Labral Repair for the Treatment of Young Adults With Femoroacetabular Impingement.,OUT_OF_SCOPE,Non-mental-health,3/3,N,Unanimous agreement
30944135,Slow release oral morphine versus methadone for the treatment of opioid use disorder.,OUT_OF_SCOPE,Review,3/3,N,Unanimous agreement
30243421,Randomized controlled pilot trial of supportive text messaging for alcohol use disorder patients.,OUT_OF_SCOPE,Non-pharmacological,3/3,N,Unanimous agreement
30630455,Prevalence and correlates of psychological distress among 13-14 year old adolescent girls in North Karnataka South India.,OUT_OF_SCOPE,Non-RCT,3/3,N,Unanimous agreement
29344340,Assessment and management of sexual dysfunction in the context of depression.,OUT_OF_SCOPE,Review,3/3,N,Unanimous agreement
26918508,General practitioners insight into deprescribing for the multimorbid older individual: a qualitative study.,OUT_OF_SCOPE,Non-RCT,3/3,N,Unanimous agreement
27725655,Structural brain changes are associated with response of negative symptoms to prefrontal repetitive transcranial magnetic stimulation in patients with schizophrenia.,OUT_OF_SCOPE,Non-pharmacological,3/3,N,Unanimous agreement
26670938,How Does the Fast Track Intervention Prevent Adverse Outcomes in Young Adulthood?,OUT_OF_SCOPE,Non-pharmacological,3/3,N,Unanimous agreement
10.1186/s40200-017-0291-9,Iran diabetes research roadmap (IDRR) study.,OUT_OF_SCOPE,Non-mental-health,3/3,N,Unanimous agreement
10.3389/fpsyg.2022.866018,Models of Psychedelic-Assisted Psychotherapy: A Contemporary Assessment and an Introduction to EMBARK.,OUT_OF_SCOPE,Review,3/3,N,Unanimous agreement
30381374,Mirtazapine added to SSRIs or SNRIs for treatment resistant depression in primary care: phase III randomised placebo controlled trial (MIR).,OUT_OF_SCOPE,Non-Canadian,3/3,N,Unanimous agreement
31246882,A Pilot Randomized Controlled Trial of Cognitive-Behavioral Therapy for Insomnia in Adolescents With Persistent Postconcussion Symptoms.,OUT_OF_SCOPE,Non-pharmacological,3/3,N,Unanimous agreement
30699842,Nutraceuticals for major depressive disorder- more is not merrier.,OUT_OF_SCOPE,Non-Canadian,3/3,N,Unanimous agreement
26460229,Optimal duration of risperidone or olanzapine adjunctive therapy to mood stabilizer following remission of a manic episode: A CANMAT randomized double-blind trial.,MAP,Mental health pharma RCT,3/3,N,Unanimous agreement
28013123,A randomized double-blind placebo-controlled crossover trial evaluating the effect of intranasal insulin on cognition and mood in individuals with treatment-resistant major depressive disorder.,MAP,Mental health pharma RCT,3/3,N,Unanimous agreement
26926882,The functional serotonin 1a receptor promoter polymorphism rs6295 is associated with psychiatric illness and differences in transcription.,OUT_OF_SCOPE,Non-RCT,3/3,N,Unanimous agreement
28289280,Biochemical physiological and clinical effects of l-methylfolate in schizophrenia: a randomized controlled trial.,UNCERTAIN,Pharmacological RCT,1/3,Y,Three-way split (MAP/OUT_OF_SCOPE/UNCERTAIN); conservative resolution to UNCERTAIN
31822848,Effectiveness of the Genomics ADvISER decision aid for the selection of secondary findings from genomic sequencing.,OUT_OF_SCOPE,Non-mental-health,3/3,N,Unanimous agreement
33031817,Trace Amine-Associated Receptor 1 (TAAR1): A new drug target for psychiatry?,OUT_OF_SCOPE,Review,3/3,N,Unanimous agreement
31906021,Exercise and Horticultural Programs for Older Adults with Depressive Symptoms and Memory Problems.,OUT_OF_SCOPE,Non-pharmacological,3/3,N,Unanimous agreement
26880694,A randomised controlled trial of the effects of a mobile telehealth intervention on clinical and patient-reported outcomes in people with poorly controlled diabetes.,OUT_OF_SCOPE,Non-mental-health,3/3,N,Unanimous agreement
29422453,Telehealth Rehabilitation for Cognitive Impairment: Randomized Controlled Feasibility Trial.,OUT_OF_SCOPE,Non-pharmacological,3/3,N,Unanimous agreement
34060934,Effects of Combined and Alone Transcranial Motor Cortex Stimulation and Mirror Therapy in Phantom Limb Pain.,OUT_OF_SCOPE,Non-mental-health,3/3,N,Unanimous agreement
36398843,Yoga for chronic non-specific low back pain.,OUT_OF_SCOPE,Review,3/3,N,Unanimous agreement
27677983,The CINP Treatment Guidelines for Bipolar Disorder in Adults Part 4.,OUT_OF_SCOPE,Review,3/3,N,Unanimous agreement
31612833,Sleep Terrors: An Updated Review.,OUT_OF_SCOPE,Review,3/3,N,Unanimous agreement
29083997,Exploring Parental and Staff Perceptions of the Family-Integrated Care Model.,OUT_OF_SCOPE,Non-RCT,3/3,N,Unanimous agreement
29542112,Laryngeal mask airway versus bag-mask ventilation or endotracheal intubation for neonatal resuscitation.,OUT_OF_SCOPE,Review,3/3,N,Unanimous agreement
28074090,Application of Machine Learning in Postural Control Kinematics for the Diagnosis of Alzheimer's Disease.,OUT_OF_SCOPE,Non-RCT,3/3,N,Unanimous agreement
30123243,Beneficial Effect of Multidomain Cognitive Training on the Neuropsychological Performance of Patients with Early-Stage Alzheimer's Disease,OUT_OF_SCOPE,Non-pharmacological,3/3,N,Unanimous agreement
34872625,Results of the First Randomized Controlled Trial of Integrated Cognitive-Behavioral Therapy for Eating Disorders and Posttraumatic Stress Disorder - CORRIGENDUM.,OUT_OF_SCOPE,Non-pharmacological,3/3,N,Unanimous agreement
36995682,Transcutaneous Auricular Vagus Nerve Stimulation (ta-VNS) for Treatment of Drug-Resistant Epilepsy.,OUT_OF_SCOPE,Non-mental-health,3/3,N,Unanimous agreement
29666372,Brain serotonin synthesis capacity in obsessive-compulsive disorder: effects of cognitive behavioral therapy and sertraline.,MAP,Mental health pharma RCT,3/3,N,Unanimous agreement
31957479,Cognitive behavioral therapy for perinatal anxiety: A randomized controlled trial.,OUT_OF_SCOPE,Non-pharmacological,3/3,N,Unanimous agreement
34328433,Online-Delivered Group and Personal Exercise Programs to Support Low Active Older Adults Mental Health During the COVID-19 Pandemic.,OUT_OF_SCOPE,Non-pharmacological,3/3,N,Unanimous agreement
30016935,The FASTER trial protocol: 6 versus 12-months of DBT for borderline personality disorder.,OUT_OF_SCOPE,Non-pharmacological,3/3,N,Unanimous agreement
37004409,Pilot study of single-dose psilocybin for serotonin reuptake inhibitor-resistant body dysmorphic disorder.,OUT_OF_SCOPE,Pharmacological RCT,2/3,N,Majority rule (2/3); dissent: UNCERTAIN
34550072,Comparing a Virtual Reality-Based Simulation App (VR-MRI) With a Standard Preparatory Manual and Child Life Program.,OUT_OF_SCOPE,Non-pharmacological,3/3,N,Unanimous agreement
34566726,Antidepressant and Anxiolytic Effects of Medicinal Cannabis Use in an Observational Trial.,OUT_OF_SCOPE,Non-RCT,3/3,N,Unanimous agreement
30984044,Repetitive Transcranial Magnetic Stimulation in Youth With Treatment Resistant Major Depression.,OUT_OF_SCOPE,Non-pharmacological,3/3,N,Unanimous agreement
31665879,Effect of simplified Tai Chi exercise on relieving symptoms of patients with mild to moderate Parkinson's disease.,OUT_OF_SCOPE,Non-pharmacological,3/3,N,Unanimous agreement
33777253,Meditating in Virtual Reality 3: 360 Video of Perceptual Presence of Instructor.,OUT_OF_SCOPE,Non-pharmacological,3/3,N,Unanimous agreement
30763425,Quality of Life in Patients With Low-Risk Prostate Cancer Treated With Hypofractionated vs Conventional Radiotherapy.,OUT_OF_SCOPE,Non-mental-health,3/3,N,Unanimous agreement
27070853,Preliminary Investigation of a Mindfulness-Based Intervention for Social Anxiety Disorder.,OUT_OF_SCOPE,Non-pharmacological,3/3,N,Unanimous agreement
29326330,Program of Integrated Care for Patients with COPD and Multiple Comorbidities (PIC COPD+).,OUT_OF_SCOPE,Non-mental-health,3/3,N,Unanimous agreement
28034509,MAXCOG: A Randomized Controlled Trial of Goal-Oriented Cognitive Rehabilitation for People with MCI and Early AD.,OUT_OF_SCOPE,Non-pharmacological,3/3,N,Unanimous agreement
36405678,Reporting Cultural Adaptation in Psychological Trials - The RECAPT criteria.,OUT_OF_SCOPE,Non-RCT,3/3,N,Unanimous agreement
29894705,Plasma biomarkers in a placebo-controlled trial comparing tDCS and escitalopram efficacy in major depression.,OUT_OF_SCOPE,Non-Canadian,3/3,N,Unanimous agreement
30243867,Perioperative Anxiety and Stress in Children Undergoing Congenital Cardiac Surgery and Their Parents.,OUT_OF_SCOPE,Non-pharmacological,3/3,N,Unanimous agreement
33807839,Target Product Profile Analysis of COVID-19 Vaccines in Phase III Clinical Trials and Beyond.,OUT_OF_SCOPE,Non-mental-health,3/3,N,Unanimous agreement
33321511,Lessons Learnt from the Second Generation of Anti-Amyloid Monoclonal Antibodies Clinical Trials.,OUT_OF_SCOPE,Review,3/3,N,Unanimous agreement
32653000,Saccharomyces cerevisiae fermentation products (SCFP) stabilize the ruminal microbiota of lactating dairy cows.,OUT_OF_SCOPE,Non-mental-health,3/3,N,Unanimous agreement
26585576,Guanfacine Extended Release: A New Pharmacological Treatment Option in Europe,OUT_OF_SCOPE,Review,3/3,N,Unanimous agreement
26620850,A subtest analysis of the Montreal cognitive assessment (MoCA).,OUT_OF_SCOPE,Non-RCT,3/3,N,Unanimous agreement
27457359,Patching for corneal abrasion,OUT_OF_SCOPE,Review,3/3,N,Unanimous agreement
31147244,Optimizing Outcomes of Treatment-Resistant Depression in Older Adults (OPTIMUM).,MAP,Pharmacological RCT,2/3,N,Majority rule (2/3); dissent: UNCERTAIN
10.1007/s12671-019-01107-9,MYmind: a Concurrent Group-Based Mindfulness Intervention for Youth with Autism and Their Parents,OUT_OF_SCOPE,Non-pharmacological,3/3,N,Unanimous agreement
10.1016/j.jcbs.2020.04.008,Reducing microaggressions and promoting interracial connection: The racial harmony workshop,OUT_OF_SCOPE,Non-pharmacological,3/3,N,Unanimous agreement
34089905,Guideline No. 420: Cytomegalovirus Infection in Pregnancy,OUT_OF_SCOPE,Non-mental-health,3/3,N,Unanimous agreement
34164675,Randomised controlled trial of the effects of increased energy intake on menstrual recovery in exercising women (REFUEL).,OUT_OF_SCOPE,Non-mental-health,3/3,N,Unanimous agreement
35588706,Efficacy of App-Based Cognitive Behavioral Therapy for Body Dysmorphic Disorder with Coach Support.,OUT_OF_SCOPE,Non-pharmacological,3/3,N,Unanimous agreement
35507432,Nucleoporin POM121 signals TFEB-mediated autophagy via activation of SIGMAR1/sigma-1 receptor chaperone by pridopidine,OUT_OF_SCOPE,Non-RCT,3/3,N,Unanimous agreement
31257092,Transcranial direct current stimulation (tDCS) for depression in pregnancy: A pilot randomized controlled trial.,OUT_OF_SCOPE,Non-pharmacological,3/3,N,Unanimous agreement
30795785,The effects of crocin on psychological parameters in patients under methadone maintenance treatment.,OUT_OF_SCOPE,Non-Canadian,3/3,N,Unanimous agreement
35600564,A Nudge-Based Intervention to Reduce Problematic Smartphone Use: Randomised Controlled Trial.,OUT_OF_SCOPE,Non-pharmacological,3/3,N,Unanimous agreement
31664960,A group randomized control trial to test the efficacy of the Road to Mental Readiness (R2MR) program among Canadian military recruits.,OUT_OF_SCOPE,Non-pharmacological,3/3,N,Unanimous agreement
32349118,The association between lithium use and neurocognitive performance in patients with bipolar disorder.,MAP,Mental health pharma RCT,3/3,N,Unanimous agreement
29673271,Beyond Silence: A Randomized Parallel-Group Trial Exploring the Impact of Workplace Mental Health Literacy Training.,OUT_OF_SCOPE,Non-pharmacological,3/3,N,Unanimous agreement
29558927,The effects of housing stability on service use among homeless adults with mental illness in a randomized controlled trial of housing first.,OUT_OF_SCOPE,Non-pharmacological,3/3,N,Unanimous agreement
33478890,Poor patient health is associated with higher caregiver burden for older adults with advanced cancer.,OUT_OF_SCOPE,Non-RCT,3/3,N,Unanimous agreement
35179044,A Randomized Trial of the Effects of Exercise on Anxiety Fear of Cancer Progression and Quality of Life in Prostate Cancer Patients on Active Surveillance.,OUT_OF_SCOPE,Non-pharmacological,3/3,N,Unanimous agreement
36328822,Mindfulness Training Changes Brain Dynamics During Depressive Rumination: A Randomized Controlled Trial.,OUT_OF_SCOPE,Non-pharmacological,3/3,N,Unanimous agreement
32987227,Family Integrated Care (FICare): Positive impact on behavioural outcomes at 18 months.,OUT_OF_SCOPE,Non-pharmacological,3/3,N,Unanimous agreement
31985831,Paracetamol (acetaminophen) for patent ductus arteriosus in preterm or low birth weight infants.,OUT_OF_SCOPE,Non-mental-health,3/3,N,Unanimous agreement
28355973,Patient-therapist convergence in alliance ratings as a predictor of outcome in psychotherapy for generalized anxiety disorder.,OUT_OF_SCOPE,Non-pharmacological,3/3,N,Unanimous agreement
37113132,Preliminary evidence for developing safe and efficient fecal microbiota transplantation as potential treatment for aged related cognitive impairments.,OUT_OF_SCOPE,Non-Canadian,3/3,N,Unanimous agreement
28413900,Efficacy of Cognitive Behavioral Therapy With and Without Medication for Adults With ADHD.,UNCERTAIN,Pharmacological RCT,2/3,N,Majority rule (2/3); dissent: OUT_OF_SCOPE
28910693,Combining child social skills training with a parent early intervention program for inhibited preschool children.,OUT_OF_SCOPE,Non-pharmacological,3/3,N,Unanimous agreement
27924459,Patient-Reported Outcomes and Quality of Life with Sunitinib Versus Placebo for Pancreatic Neuroendocrine Tumors.,OUT_OF_SCOPE,Non-mental-health,3/3,N,Unanimous agreement
31513675,Implementation of intermittent theta burst stimulation compared to conventional repetitive transcranial magnetic stimulation in patients with treatment resistant depression: A cost analysis.,OUT_OF_SCOPE,Non-pharmacological,3/3,N,Unanimous agreement
27613885,Effects of 6-Week Use of Reduced-Nicotine Content Cigarettes in Smokers With and Without Elevated Depressive Symptoms.,OUT_OF_SCOPE,Non-Canadian,3/3,N,Unanimous agreement
27997654,Association Between the Birth of an Infant With Major Congenital Anomalies and Subsequent Risk of Mortality in Their Mothers.,OUT_OF_SCOPE,Non-RCT,3/3,N,Unanimous agreement
28549563,No. 346-Advanced Reproductive Age and Fertility,OUT_OF_SCOPE,Non-mental-health,3/3,N,Unanimous agreement
28068779,Norepinephrine transporter gene variants and remission from depression with venlafaxine treatment in older adults,MAP,Mental health pharma RCT,3/3,N,Unanimous agreement
39150594,Glutamatergic Modulators for Major Depression from Theory to Clinical Use.,OUT_OF_SCOPE,Review,3/3,N,Unanimous agreement
39074480,Endovascular thrombectomy for acute ischaemic stroke with established large infarct (TENSION): 12-month outcomes.,OUT_OF_SCOPE,Non-mental-health,3/3,N,Unanimous agreement
37890129,Elexacaftor/Tezacaftor/Ivacaftor Treatment and Depression-related Events.,OUT_OF_SCOPE,Non-mental-health,3/3,N,Unanimous agreement
35272210,MDMA-assisted therapy significantly reduces eating disorder symptoms in a randomized placebo-controlled trial of adults with severe PTSD.,UNCERTAIN,Pharmacological RCT,2/3,N,Majority rule (2/3); dissent: OUT_OF_SCOPE
31433483,Cost-effectiveness of Housing First Intervention With Intensive Case Management for Homeless Adults With Mental Illness.,OUT_OF_SCOPE,Non-pharmacological,3/3,N,Unanimous agreement
33120207,Longitudinal interrelationships of mental health discrimination and stigma with housing and well-being outcomes.,OUT_OF_SCOPE,Non-pharmacological,3/3,N,Unanimous agreement
29388901,Alliance Rupture and Resolution in Dialectical Behavior Therapy for Borderline Personality Disorder.,OUT_OF_SCOPE,Non-pharmacological,3/3,N,Unanimous agreement
28103079,ADHD Treatment in Primary Care: Demographic Factors Medication Trends and Treatment Predictors.,OUT_OF_SCOPE,Non-RCT,3/3,N,Unanimous agreement
36070308,The impact of a brief mindfulness training on interoception: A randomized controlled trial.,OUT_OF_SCOPE,Non-pharmacological,3/3,N,Unanimous agreement
32312344,The network structure of core depressive symptom-domains in MDD following antidepressant treatment: a randomized clinical trial.,MAP,Mental health pharma RCT,3/3,N,Unanimous agreement
31869478,Reducing preoperative anxiety with Child Life preparation prior to intravenous induction of anesthesia.,OUT_OF_SCOPE,Non-pharmacological,3/3,N,Unanimous agreement
28206715,Housing First for older homeless adults with mental illness: a subgroup analysis of At Home/Chez Soi.,OUT_OF_SCOPE,Non-pharmacological,3/3,N,Unanimous agreement
33710292,Machine Learning Assessment of Early Life Factors Predicting Suicide Attempt in Adolescence or Young Adulthood.,OUT_OF_SCOPE,Non-RCT,3/3,N,Unanimous agreement
30755255,Evaluation of BI 409306 a novel phosphodiesterase type 9 inhibitor in two phase II studies in prodromal and mild Alzheimer's disease.,MAP,Mental health pharma RCT,3/3,N,Unanimous agreement
33559704,Effects of linagliptin vs glimepiride on cognitive performance in type 2 diabetes: CAROLINA-COGNITION study.,OUT_OF_SCOPE,Non-mental-health,3/3,N,Unanimous agreement
34305689,The Effect of Chinese Square Dance Exercise on Cognitive Function in Older Women With Mild Cognitive Impairment.,OUT_OF_SCOPE,Non-pharmacological,3/3,N,Unanimous agreement
31398593,Feasibility and clinical effects of theta burst stimulation in youth with major depressive disorders.,OUT_OF_SCOPE,Non-pharmacological,3/3,N,Unanimous agreement
26715229,Long-Term Effects of Two Formats of Cognitive Behavioral Therapy for Insomnia Comorbid with Breast Cancer.,OUT_OF_SCOPE,Non-pharmacological,3/3,N,Unanimous agreement
28389421,Pregnant Womens Views on the Feasibility and Acceptability of Web-Based Mental Health E-Screening.,OUT_OF_SCOPE,Non-pharmacological,3/3,N,Unanimous agreement
26963600,Impact of comorbid anxiety and depressive disorders on treatment response to CBT for insomnia.,OUT_OF_SCOPE,Non-pharmacological,3/3,N,Unanimous agreement
31296043,Michigan stroke transitions trial: A clinical trial to improve stroke transitions,OUT_OF_SCOPE,Non-pharmacological,3/3,N,Unanimous agreement
26482056,A Randomized Placebo-Controlled Discontinuation Study of Cholinesterase Inhibitors in Institutionalized Patients With Moderate to Severe Alzheimer Disease.,MAP,Mental health pharma RCT,3/3,N,Unanimous agreement
35641246,Variation in Peritoneal Dialysis Time on Therapy by Country.,OUT_OF_SCOPE,Non-mental-health,3/3,N,Unanimous agreement
30636629,CHIMERA repetitive mild traumatic brain injury induces chronic behavioural and neuropathological phenotypes in mice.,OUT_OF_SCOPE,Non-RCT,3/3,N,Unanimous agreement
27148765,Association between Daytime Activity Fatigue Sleep Anxiety Depression and Symptom Burden in Advanced Cancer Patients.,OUT_OF_SCOPE,Non-RCT,3/3,N,Unanimous agreement
26974214,Factors associated with relapse in schizophrenia despite adherence to long-acting injectable antipsychotic therapy.,MAP,Mental health pharma RCT,3/3,N,Unanimous agreement
29197258,Prevalence of mild cognitive impairment and its subtypes in community-dwelling residents aged 65 years or older in Guangzhou China.,OUT_OF_SCOPE,Non-RCT,3/3,N,Unanimous agreement
28220571,Genetic risk factors for cognitive decline in Parkinson's disease: a review of the literature,OUT_OF_SCOPE,Review,3/3,N,Unanimous agreement
10.3389/fnsyn.2018.00018,The Intersection of Central Dopamine System and Stroke: Potential Avenues Aiming at Enhancement of Motor Recovery,OUT_OF_SCOPE,Review,3/3,N,Unanimous agreement
30572160,ELEctroconvulsive therapy (ECT) vs. Ketamine in patients with Treatment-resistant Depression: The ELEKT-D study protocol,OUT_OF_SCOPE,Protocol,3/3,N,Unanimous agreement
33487078,Nutrition-based interventions for mood disorders,OUT_OF_SCOPE,Review,3/3,N,Unanimous agreement
35582784,Predictive Value of Acute Neuroplastic Response to rTMS in Treatment Outcome in Depression.,OUT_OF_SCOPE,Non-pharmacological,3/3,N,Unanimous agreement
10.1093/ijnp/pyab082,Sex Differences in the Behavioral Molecular and Structural Effects of Ketamine Treatment in Depression,OUT_OF_SCOPE,Review,3/3,N,Unanimous agreement
36227593,Effect of Exercise Training or Complex Mental and Social Activities on Cognitive Function in Adults With Chronic Stroke.,OUT_OF_SCOPE,Non-pharmacological,3/3,N,Unanimous agreement
35569503,The EMPOWER blended digital intervention for relapse prevention in schizophrenia.,OUT_OF_SCOPE,Non-pharmacological,3/3,N,Unanimous agreement
30954442,Oxytocin Selectively Improves Empathic Accuracy: A Replication in Men and Novel Insights in Women.,OUT_OF_SCOPE,Non-mental-health,2/3,N,Majority rule (2/3); dissent: UNCERTAIN
33495545,Accelerated brain aging predicts impulsivity and symptom severity in depression.,OUT_OF_SCOPE,Non-RCT,3/3,N,Unanimous agreement
33900401,Association Between Bariatric Surgery and Major Adverse Diabetes Outcomes in Patients With Diabetes and Obesity.,OUT_OF_SCOPE,Non-mental-health,3/3,N,Unanimous agreement
33813233,A very brief self-report scale for measuring insomnia severity using two items from the ISI.,OUT_OF_SCOPE,Non-RCT,3/3,N,Unanimous agreement
30017006,The effectiveness and cost-effectiveness of the Incredible Years Teacher Classroom Management programme.,OUT_OF_SCOPE,Non-pharmacological,3/3,N,Unanimous agreement
35841252,Clinical Trial Endpoints and Their Clinical Meaningfulness in Early Stages of Alzheimer's Disease.,OUT_OF_SCOPE,Review,3/3,N,Unanimous agreement
29777003,Impact of Reference and Target Region Selection on Amyloid PET SUV Ratios in the Phase 1b PRIME Study of Aducanumab.,MAP,Mental health pharma RCT,2/3,N,Majority rule (2/3); dissent: OUT_OF_SCOPE
30719013,Adverse Behavioral Changes in Adult Mice Following Neonatal Repeated Exposure to Pain and Sucrose.,OUT_OF_SCOPE,Non-RCT,3/3,N,Unanimous agreement
28760403,Health-related quality of life for immediate versus delayed androgen-deprivation therapy for prostate cancer (TOAD).,OUT_OF_SCOPE,Non-mental-health,3/3,N,Unanimous agreement
